283,10/10/17 10:28,Concept,I do not understand how parameters are passed into functions; ,< 5 minutes,,iceberg lettuce,10/10/17 10:46,10:46:02,Understanding passing and returnng val from fxn (logic error)361,10/10/17 10:32,HW/Project,Confused on how to implement code,31 - 60 minutes,,iceberg lettuce,10/10/17 10:49,10:49:32,Needed help with scoping issues for fxns283,10/10/17 10:55,Lab,The lab Ta told me there was a shorter way to do Lab 5; however I have not thought of it; Could someone help me figure it out?,16 - 30 minutes,,iceberg lettuce,10/10/17 10:55,10:55:55,Needed help with lab4 logic; used multiple ifs; instead of indexing votes376,10/10/17 11:13,HW/Project,I have a question regarding function headlines for part 1 of the homework;,6 - 15 minutes,,eggplant,10/10/17 11:13,11:13:56,Needed clarification on how he is approaching hw5 part 1376,10/10/17 11:18,HW/Project,"Question about error; global name"" is not defined""",< 5 minutes,,eggplant,10/10/17 11:19,11:19:10,Needed clarification on how function parameters and arguements work264,10/10/17 11:18,Lab,lab check,31 - 60 minutes,,eggplant,10/10/17 11:22,11:22:22,Needed lab checked off for extra point555,10/10/17 11:32,HW/Project,Help starting hw1,6 - 15 minutes,,eggplant,10/10/17 11:33,11:33:20,Needed some guidance on okay methods to approach part 1376,10/10/17 11:34,HW/Project,I am not understanding why my program is splitting on a blank space even though it is suppose to split on a letter;,6 - 15 minutes,,eggplant,10/10/17 11:38,11:38:17,nevermind343,10/10/17 11:57,HW/Project,dont know what goes in functions,6 - 15 minutes,,eggplant,10/10/17 11:57,11:57:57,Needed a bit of explanation behind function usage242,10/10/17 12:00,HW/Project,Unknown error message;  Incorrect parameters when parameters are correct?,> 60 minutes,,eggplant,10/10/17 12:02,12:02:19,He was passing in 3 arguements into the input function376,10/10/17 12:10,HW/Project,I am having trouble understanding part 2;,6 - 15 minutes,,eggplant,10/10/17 12:12,12:12:23,Having trouble understanding some of the string manipulation involved in the homework343,10/10/17 12:18,HW/Project,hw4 functions,6 - 15 minutes,,eggplant,10/10/17 12:18,12:18:54,Trouble understanding where to place print statements437,10/10/17 12:22,HW/Project,My program is half running and I am not sure why;,16 - 30 minutes,,eggplant,10/10/17 12:22,12:22:39,Had a great approach to the project but got confused on which string lengths to use where376,10/10/17 12:25,HW/Project,Still having trouble understanding part 2;,6 - 15 minutes,,eggplant,10/10/17 12:31,12:31:12,He  s overcomplicating a pretty simple task it seems242,10/10/17 12:41,HW/Project,Print statement not executing;  No error message;,16 - 30 minutes,,eggplant,10/10/17 12:42,12:42:18,Was using length of word instead of length -1376,10/10/17 12:45,HW/Project,I do not understand why my code is not executing properly;,6 - 15 minutes,,eggplant,10/10/17 12:45,12:45:55,Just needed an extra set of eyes to check for syntax errors219,10/10/17 12:46,Lab,I had trouble defining and calling a minimum and a maximum function; lab not finished,31 - 60 minutes,,eggplant,10/10/17 12:49,12:49:44,Came in to get extra point on lab and clarify some questions about lab503,10/10/17 12:48,HW/Project,method ,> 60 minutes,,eggplant,10/10/17 12:53,12:53:17,Over complicating part2 of homework 5361,10/10/17 13:01,HW/Project,while loop in the function isn  t checking input again,31 - 60 minutes,,squash,10/10/17 13:01,13:01:49,Was returning in part 3 when they didn  t need to224,10/10/17 13:12,HW/Project,How to keep track of an element  s index  inside of a string,31 - 60 minutes,,squash,10/10/17 13:13,13:13:10,Suggested that they use another variable to keep track of where they found a complete match456,10/10/17 13:18,HW/Project,The program is supposed to index every time a phrase in a string appears; but it only does it once for the last time the string in question appears;,> 60 minutes,,squash,10/10/17 13:19,13:19:30,String slicing was wrong and indexed incorrectly188,10/10/17 13:23,HW/Project,My program only runs one iteration of a nested while loop;;;,> 60 minutes,,squash,10/10/17 13:30,13:30:44,student left338,10/10/17 13:27,HW/Project,I am not sure how to use another function,31 - 60 minutes,,squash,10/10/17 13:31,13:31:18,Showed him how functions work and how to pass in parameters242,10/10/17 13:33,HW/Project,EXIT sentinel has no effect on loop;,16 - 30 minutes,,squash,10/10/17 13:36,13:36:08,Suggested that he use conditional statements to check for EXIT465,10/10/17 14:31,HW/Project,I  m stuck on the concepts I need to know in order to complete the homework;,16 - 30 minutes,,tomatillo,10/10/17 14:32,14:32:20,Concept of the first part 338,10/10/17 14:32,HW/Project,How to find the word in the sentence,31 - 60 minutes,,tomatillo,10/10/17 14:38,14:38:25,Help with splicing 340,10/10/17 14:32,HW/Project,My if statement will not execute;,31 - 60 minutes,,tomatillo,10/10/17 14:45,14:45:56,Out of scope343,10/10/17 14:33,HW/Project,#2 making while loops in the functions,6 - 15 minutes,,tomatillo,10/10/17 14:50,14:50:24,concept of the first part 522,10/10/17 14:34,HW/Project,I am not sure about reverse strings for part 5 of the homework;,31 - 60 minutes,,tomatillo,10/10/17 14:56,14:56:09,concatination 429,10/10/17 14:38,HW/Project,For #1 and 2 are we allowed to use the in operator?  Also #2 do we use ;split()?  And for 5 my algorithm for printing the elements for reverse order isn  t working; but reversing the string is; ,6 - 15 minutes,,mango,10/10/17 14:58,14:58:00,Help going backwards through a list535,10/10/17 14:45,HW/Project,I need help with checking for punctuation in Part 3,6 - 15 minutes,,tomatillo,10/10/17 15:00,15:00:12,COding standards 376,10/10/17 14:47,HW/Project,"I am getting a string index out of range"" issue on part 3 of the homework when I am trying to code in the ability for the user to press Enter without typing in anything to exit the program;""",6 - 15 minutes,,mango,10/10/17 15:02,15:02:20,nevermind338,10/10/17 14:50,HW/Project,it gives only one result in loop,6 - 15 minutes,,mango,10/10/17 15:02,15:02:45,understanding spliting575,10/10/17 14:53,HW/Project,I think I need help with string slicing,16 - 30 minutes,,tomatillo,10/10/17 15:06,15:06:37,Help with issue regrading splicing 503,10/10/17 14:56,HW/Project,string object does not support item assignment,31 - 60 minutes,,mango,10/10/17 15:12,15:12:23,string concat343,10/10/17 15:05,HW/Project,problem 4; finding the substring of the phrase ,16 - 30 minutes,,tomatillo ,10/10/17 15:15,15:15:48,While loop help with splicing 429,10/10/17 15:06,HW/Project,Casting issue in part 6,< 5 minutes,,mango,10/10/17 15:17,15:17:38,When to cast to float part6522,10/10/17 15:09,HW/Project,I am not sure how to print the items in reverse order for part 5 of the homework;,31 - 60 minutes,,mango,10/10/17 15:19,15:19:22,printing the words in reverse340,10/10/17 15:18,HW/Project,not sure what this error message means,6 - 15 minutes,,tomatillo,10/10/17 15:21,15:21:39,Casting as a str in a print statement 114,10/10/17 15:19,HW/Project,"I do not know what the error NoneType object has no attribute to upper"" means""",16 - 30 minutes,,mango,10/10/17 15:22,15:22:23,Help with noneType coming from print; should have used input503,10/10/17 15:26,HW/Project,two variables in the call function,> 60 minutes,,mango,10/10/17 15:26,15:26:17,Help with order in string concat338,10/10/17 15:33,HW/Project,I  m not sure where I need to put my string,6 - 15 minutes,,tomatillo,10/10/17 15:33,15:33:20,Concept of question 5123,10/10/17 15:37,HW/Project,Program will not count correctly,> 60 minutes,,mango,10/10/17 15:37,15:37:16,Help with function parameters361,10/10/17 15:39,HW/Project,cant figure out how to print a word backwards,31 - 60 minutes,,mango,10/10/17 15:44,15:44:39,Help with counting backwords114,10/10/17 15:40,HW/Project,Still saying that my variable is a NoneType and has no attribute to upper; and I am struggling to check for punctuation; ,16 - 30 minutes,,tomatillo ,10/10/17 15:46,15:46:55,Taking in input with print 343,10/10/17 15:40,HW/Project,#2 stuck on getting the substring of the word i need,31 - 60 minutes,,mango,10/10/17 15:54,15:54:05,student left261,10/10/17 15:41,HW/Project,My program is not iterating across a string; I don  t really understand how to correctly increment my string,> 60 minutes,,mango,10/10/17 15:54,15:54:57,Help with nesting while loops503,10/10/17 15:44,HW/Project,confusing sequences ,> 60 minutes,,tomatillo ,10/10/17 15:58,15:58:41,Help with using two while loops 338,10/10/17 15:51,HW/Project,It doesn  t show the result after I put all the code for backwards,6 - 15 minutes,,ugli fruit,10/10/17 16:03,16:03:31,Helped figure out print/list backwards361,10/10/17 16:03,HW/Project,Wont print word backwards right,> 60 minutes,,tomatillo ,10/10/17 16:05,16:05:19,Help with making the word backwards 503,10/10/17 16:15,HW/Project,could not convert string to float ,> 60 minutes,,tomatillo ,10/10/17 16:16,16:16:11,Help with while loop input 123,10/10/17 16:23,HW/Project,I don  t understand how to count individual letters,> 60 minutes,,tomatillo ,10/10/17 16:25,16:25:33,Help understanding the concept of functions and parameters 503,10/10/17 16:33,HW/Project,defined variables; reference before assignment ,> 60 minutes,,ugli fruit,10/10/17 16:36,16:36:36,Helped figure out function call error for part6555,10/10/17 16:34,HW/Project,Help starting hw5 part 2,6 - 15 minutes,,ugli fruit,10/10/17 16:48,16:48:31,Helped figure out how to start with part 2338,10/10/17 16:42,HW/Project,the reverse words is not working with a code,16 - 30 minutes,,berry,10/10/17 16:48,16:48:42,For part 5 he wanted to know how the function worked (not using a while loop to print every letter)246,10/10/17 16:43,HW/Project,Part 1 - error I don  t   understand Part 6 -saying can  t convert a string to a float,31 - 60 minutes,,ugli fruit,10/10/17 17:03,17:03:39,Helped resolve an error in passing data to function361,10/10/17 16:52,HW/Project,confused on how to pass a list to a new function and find average,31 - 60 minutes,,berry,10/10/17 17:04,17:04:57,Help her with sentinal loop order 261,10/10/17 17:05,HW/Project,My program will not stop at the end of my string causing an index error; I am not sure how to stop my program from continuing to increment beyond the length of my string,16 - 30 minutes,,ugli fruit,10/10/17 17:22,17:22:14,Helped figure out easier way to approach searching for word130,10/10/17 17:21,HW/Project,hw5 pt3; i need help figuring out how to re ask the user for input again; or does it have to end after they enter an input and the program returns true or false/ right or wrong?,> 60 minutes,,ugli fruit,10/10/17 17:39,17:39:33,Just helped clarify part 3 needs to use a while loop343,10/10/17 17:30,HW/Project,substring the word,> 60 minutes,,ugli fruit,10/10/17 17:41,17:41:39,Student had fixed program while waiting130,10/10/17 17:44,HW/Project,Hw5 pt2; for this part i need help in figuring out how to splice or split the string so that the word were searching for will be found;,> 60 minutes,,ugli fruit,10/10/17 17:45,17:45:13,Got student started in thinking about how to slice the input string188,10/11/17 10:01,HW/Project,Having a conceptual problem understand how to place the first character in the last spot and the second character in the second to last spot;;;,> 60 minutes,,fiddlehead,10/11/17 10:02,10:02:00,worked on functions and string reversing536,10/11/17 10:02,Lab,LAB CHECK - watermelon,16 - 30 minutes,,watermelon,10/11/17 10:03,10:03:00,Graded lab 05 for a 7257,10/11/17 10:08,HW/Project,For homework part 6 I am having trouble converting the string list into floats,16 - 30 minutes,,watermelon,10/11/17 10:12,10:12:31,explained when to cast input to float; instead of immediately233,10/11/17 10:13,HW/Project,not sure,31 - 60 minutes,,fiddlehead,10/11/17 10:19,10:19:04,helped understand functions555,10/11/17 10:17,HW/Project,argument error; too many arguments,6 - 15 minutes,,fiddlehead,10/11/17 10:26,10:26:49,helped understand concatonation with input367,10/11/17 10:25,Lab,Get a point back from Lab #5; Also; I have a question about the homework;,6 - 15 minutes,,watermelon,10/11/17 10:35,10:35:36,graded lab 05 for a 7; explained why it  s good to have descriptive variable names543,10/11/17 10:29,HW/Project,HW 2 revision,> 60 minutes,,fiddlehead,10/11/17 10:35,10:35:36,my student going over hw2 grade257,10/11/17 10:34,HW/Project,Having problems on part 6 on converting the float into a string in the case of the sentinel and making,6 - 15 minutes,,fiddlehead,10/11/17 10:44,10:44:38,helped understand logic of input in while loops233,10/11/17 10:43,HW/Project,case sensitivity,6 - 15 minutes,,watermelon,10/11/17 10:47,10:47:58,mentioned use of upper or lower to make strings same case510,10/11/17 10:44,HW/Project,Need help with reversing my list;,> 60 minutes,,fiddlehead,10/11/17 10:53,10:53:35,helped understand hw description555,10/11/17 10:54,HW/Project,Help with part 5; trying to figure out how to move forward,6 - 15 minutes,,quince ,10/11/17 11:03,11:03:04,string indexing 570,10/11/17 11:15,Lab,Show my last weeks lab,16 - 30 minutes,,quince ,10/11/17 11:15,11:15:09,checked123,10/11/17 11:20,HW/Project,Can  t figure out how to count number of indexes printed,31 - 60 minutes,,quince ,10/11/17 11:22,11:22:03,totaling & other HW questions 510,10/11/17 11:22,HW/Project,need help with reversing list,31 - 60 minutes,,quince ,10/11/17 11:30,11:30:10,iterating backwards570,10/11/17 11:24,HW/Project,Indexing by the character rather than by word,6 - 15 minutes,,quince ,10/11/17 11:39,11:39:23,substring question549,10/11/17 11:28,HW/Project,hw5_part4;py function call variable arugment,16 - 30 minutes,,quince ,10/11/17 11:44,11:44:19,calling function too early 238,10/11/17 13:04,HW/Project,STR input errors,16 - 30 minutes,,vanilla,10/11/17 13:04,13:04:17,Use square brackets instead of parentheses503,10/11/17 13:14,HW/Project,str object is not callable,> 60 minutes,,vanilla,10/11/17 13:15,13:15:11,HIs function and string were named the same thing362,10/11/17 13:34,HW/Project,problem with mkdir,6 - 15 minutes,,grape,10/11/17 13:36,13:36:44,Wanted to move things into directories338,10/11/17 13:41,HW/Project,I am not sure how to list of floats add each other,31 - 60 minutes,,grape,10/11/17 13:44,13:44:30,Catching return values503,10/11/17 13:51,HW/Project,call the third function,> 60 minutes,,vanilla,10/11/17 13:51,13:51:30,Asking about the purpose of each designated function listed in hw362,10/11/17 13:56,HW/Project,concept involving slicing,< 5 minutes,,grape,10/11/17 13:56,13:56:57,Needed help with iterating over a string112,10/11/17 14:17,HW/Project,hw5 part5 how to combine the reverse word,> 60 minutes,,horseradish,10/11/17 14:18,14:18:44,Move a print statement out of a while loop510,10/11/17 14:19,HW/Project,Need help with printing,31 - 60 minutes,,vanilla,10/11/17 14:21,14:21:59,List wasn  t printing out in the desired format362,10/11/17 14:24,HW/Project,while loop,6 - 15 minutes,,vanilla,10/11/17 14:26,14:26:50,Having trouble using while loop with string311,10/11/17 14:42,HW/Project,Problem with string not being found,16 - 30 minutes,,horseradish,10/11/17 14:44,14:44:53,Need a while within a while262,10/11/17 14:46,HW/Project,Not sure how to bring up a value from a list;,31 - 60 minutes,,vanilla,10/11/17 14:49,14:49:15,Working through logic of hw 5 problem 1362,10/11/17 15:13,HW/Project,output problem ( index fixing),6 - 15 minutes,,horseradish,10/11/17 15:16,15:16:42,Help iterating through the phrase in word search235,10/11/17 15:20,HW/Project,"Meaning of Output: None""; having trouble visualizing how to approach getting specific index of each word in phrase""",31 - 60 minutes,,horseradish,10/11/17 15:45,15:45:18,Help iterating through the phrase in word search362,10/11/17 15:39,HW/Project,fixing outputs,6 - 15 minutes,,yam,10/11/17 16:11,16:11:47,not consistent with variables325,10/11/17 15:41,HW/Project,I need help making my program index from the start of certain words in hw5 part2;,16 - 30 minutes,,olive,10/11/17 15:56,15:56:39,help understand slicing in the loop115,10/11/17 15:46,HW/Project,want to check if my overall strategy is going in the right direction; Trying to go through a string and check every word and mark index location; ,16 - 30 minutes,,horseradish,10/11/17 15:54,15:54:28,Help iterating through the phrase in word search503,10/11/17 15:49,HW/Project,format,< 5 minutes,,olive,10/11/17 16:01,16:01:55,help with format for comment headers460,10/11/17 15:49,HW/Project,My code isn  t doing what I expect it to;,31 - 60 minutes,,olive,10/11/17 16:06,16:06:05,trying to slice past the end of the string426,10/11/17 15:56,HW/Project,"I was confused on how to make a certain condition for hw5 part1; Also; are you able to use the in"" function in the hw?""",16 - 30 minutes,,yam,10/11/17 16:06,16:06:39,Used upper(letter) not letter;upper()361,10/11/17 16:01,Lab,printing min and max trouble,31 - 60 minutes,,olive,10/11/17 16:09,16:09:15,help with lab 6517,10/11/17 16:04,Lab,Check my working lab program that I completed after the time was over,31 - 60 minutes,,yam,10/11/17 16:17,16:17:13,Checking off lab193,10/11/17 16:05,HW/Project,adding to a list,6 - 15 minutes,,olive,10/11/17 16:17,16:17:14,help with running total and casting233,10/11/17 16:07,HW/Project,trouble with case sensitivity,31 - 60 minutes,,yam,10/11/17 16:18,16:18:48,Didn  t know how to pass multiple parameters503,10/11/17 16:08,HW/Project,different output,6 - 15 minutes,,olive,10/11/17 16:22,16:22:30,placing of in main instead of function535,10/11/17 16:10,HW/Project,I need help try to average all of the numbers in Part 6,6 - 15 minutes,,yam,10/11/17 16:24,16:24:07,was reassigning average num with every while loop iteration361,10/11/17 16:18,HW/Project,Need help implementing code for my idea for iterating through a list,31 - 60 minutes,,radish,10/11/17 16:25,16:25:38,When to print with an index362,10/11/17 16:23,HW/Project,Comparing string,6 - 15 minutes,,olive,10/11/17 16:29,16:29:09,had vaildation in function instead of main325,10/11/17 16:25,HW/Project,Cannot get an if statement to work to find out if the user specified word is equivalent to the subphrase created through slicing;,16 - 30 minutes,,radish,10/11/17 16:30,16:30:30,How to use upper and lower with correct syntax362,10/11/17 16:44,HW/Project,hw5 output    while loop,< 5 minutes,,radish,10/11/17 16:45,16:45:25,Needed help with correct while syntax460,10/11/17 16:47,HW/Project,The program isn  t printing out what I think it would;,> 60 minutes,,olive,10/11/17 16:47,16:47:56,help with debugging535,10/11/17 16:47,HW/Project,I need help trying to reverse the string in Part 5,6 - 15 minutes,,yam,10/11/17 16:48,16:48:02,Approach on backwards problem362,10/11/17 16:53,Concept,Boolean flag,< 5 minutes,,yam,10/11/17 16:54,16:54:04,Did not understand boolean flags (why and how to use)246,10/11/17 16:58,HW/Project,Part 2 isn  t doing anything when I try to run it,31 - 60 minutes,,olive,10/11/17 16:58,16:58:30,wasn  t using input460,10/11/17 17:02,HW/Project,One quick question about input and outputs,> 60 minutes,,yam,10/11/17 17:16,17:16:29,nevermind246,10/11/17 17:04,HW/Project,Part 2 no output but no error,31 - 60 minutes,,yam,10/11/17 17:17,17:17:29,whoops; no note 412,10/11/17 17:19,Lab,I need a lab checked for a 7/8,< 5 minutes,,yam,10/11/17 17:45,17:45:27,Lab check517,10/11/17 17:21,HW/Project,"Trying to figure out how to increase value number for each input while asking for an input (getting error message: input expected at most 1 arguments; got 3"")""",6 - 15 minutes,,yam,10/11/17 17:47,17:47:11,input doesn  t take multiple parameters; string concatenation130,10/11/17 17:21,HW/Project,hw5 pt5; i need help figuring out how to make all the result print and also print out the number of the string the user is entering; like string#1; 2;; etc,> 60 minutes,,yam,10/11/17 17:52,17:52:23,Was using weird index thing and didn  t read the doc185,10/11/17 17:25,HW/Project,I  m not sure how to go about the function part of the second hw problem; Also; I am not sure if I am using boolean flag correctly for prompting the user for correct output; ,16 - 30 minutes,,radish,10/11/17 17:53,17:53:26,CHecking for substring586,10/11/17 17:29,HW/Project,I need help with homework 5; part 2;,16 - 30 minutes,,yam,10/11/17 17:58,17:58:39,How to slice strings535,10/11/17 17:36,HW/Project,I need help looking for specific phrases in Part 2,16 - 30 minutes,,radish,10/11/17 17:59,17:59:22,Needed help with finding substring362,10/11/17 17:39,HW/Project,function,6 - 15 minutes,,,,,office hours over517,10/12/17 10:00,HW/Project,Figuring out how to print strings spelled backwards from a list,> 60 minutes,,iceberg lettuce,10/12/17 10:15,10:15:06,Issue with count var 112,10/12/17 10:00,HW/Project,hw5 part6 calculating average,31 - 60 minutes,,grape,10/12/17 10:15,10:15:37,Index out of range errors555,10/12/17 10:06,HW/Project,help with expected indentation block and concatenation,6 - 15 minutes,,grape,10/12/17 10:28,10:28:01,Confused about stop as a string and temp as a float578,10/12/17 10:21,HW/Project,Functions,31 - 60 minutes,,grape,10/12/17 10:31,10:31:11,Confused about how backwards is supposed to work517,10/12/17 10:37,HW/Project,"Help on proper way to use return"" and printing the average of list values""",16 - 30 minutes,,iceberg lettuce,10/12/17 10:41,10:41:26,Needed help with return concept555,10/12/17 10:39,HW/Project,part 6; trying to figure out how to get average of list,6 - 15 minutes,,iceberg lettuce,10/12/17 10:46,10:46:33,Needed avg number findig help340,10/12/17 10:48,Concept,Can you search for part of a word in a string using in?,6 - 15 minutes,,grape,10/12/17 10:53,10:53:59,whoops; no note 173,10/12/17 10:48,HW/Project,How to set up the logic/code for Homework 5 Part 2 ,16 - 30 minutes,,grape,10/12/17 10:56,10:56:42,Needed help with the concept246,10/12/17 10:54,HW/Project,Part 5 - backwards function,31 - 60 minutes,,iceberg lettuce,10/12/17 10:57,10:57:24,not here578,10/12/17 10:54,HW/Project,Function,31 - 60 minutes,,iceberg lettuce,10/12/17 10:57,10:57:57,Had an infinite loop 552,10/12/17 10:55,HW/Project,Confusion on how to approach comparing lists,31 - 60 minutes,,grape,10/12/17 11:04,11:04:10,Needed help with every part of part 1 *sad face*376,10/12/17 10:55,HW/Project,I am having trouble making the word backwards in part 5 of the homework;,6 - 15 minutes,,daikon,10/12/17 11:06,11:06:01,help with concept of adding string517,10/12/17 10:57,HW/Project,"(This is my last question; I promise)getting error for unsupported operand type because I  m trying to use a string (STOP"") to stop adding to a list of floats""",6 - 15 minutes,,daikon,10/12/17 11:11,11:11:32,problem with casting float before checking to make sure it wasnt a string585,10/12/17 11:00,HW/Project,When I run the program; it is exiting before it should because of some problem with scope;,31 - 60 minutes,,daikon,10/12/17 11:13,11:13:54,counter placed in wrong spot - infinitely looping340,10/12/17 11:06,HW/Project,I  m having trouble thinking of how to search for a word in a phrase while keeping track of the index that the word was in;,6 - 15 minutes,,daikon,10/12/17 11:17,11:17:17,algorithmic 549,10/12/17 11:11,HW/Project,hw5_part5;py not casting my string ans search letter correctly,6 - 15 minutes,,daikon,10/12/17 11:23,11:23:52,rubber duck?555,10/12/17 11:12,HW/Project,help with part 1; to find instances letter is in string,6 - 15 minutes,,daikon,10/12/17 11:28,11:28:11,error with using lower426,10/12/17 11:25,HW/Project,hw5 part 3 - I have to hit enter twice to exit the program; It needs to be one enter; ,16 - 30 minutes,,daikon,10/12/17 11:32,11:32:25,nevermind?414,10/12/17 11:28,HW/Project,Ho do I get my code to a count the number of times a letter appears in a string? ,31 - 60 minutes,,daikon,10/12/17 11:40,11:40:39,algorithmic 376,10/12/17 11:36,HW/Project,Wondering if I have to put the      s near the string names in part 5;,6 - 15 minutes,,daikon,10/12/17 11:43,11:43:19,nevermind549,10/12/17 11:38,HW/Project,hw5_part2;py creating the proper search function,6 - 15 minutes,,daikon,10/12/17 11:43,11:43:57,fishing319,10/12/17 11:40,HW/Project,I am having some trouble with part 2 of the hw; specifically iterating through lists ,31 - 60 minutes,,daikon,10/12/17 11:51,11:51:47,help getting started114,10/12/17 11:41,HW/Project,Error telling me def main(): should be indented; do not know how to reverse the string ,> 60 minutes,,,,,office hours over426,10/12/17 11:53,HW/Project,Do inputs need to be within the functions outside of main?,16 - 30 minutes,,,,,office hours over350,10/12/17 11:56,HW/Project,I dont know how to solve part 2 of homework 5;,> 60 minutes,,,,,office hours over549,10/12/17 11:58,HW/Project,hw5_part2;py still having issue using a phrase for search,6 - 15 minutes,,,,,office hours over549,10/12/17 12:58,HW/Project,hw5_part2;py ,> 60 minutes,,lima,10/12/17 12:58,12:58:46,Slicing problem362,10/12/17 12:58,HW/Project,hw5 part3,< 5 minutes,,lima,10/12/17 13:03,13:03:23,Needed help seeing if first letter cap552,10/12/17 12:58,HW/Project,Ending a Loop,31 - 60 minutes,,lima,10/12/17 13:07,13:07:50,looking for letters confusion350,10/12/17 12:59,HW/Project,Homework 5,> 60 minutes,,lima,10/12/17 13:17,13:17:49,student left235,10/12/17 12:59,HW/Project,Validity of my approach to reversing strings in problem 5 of hw5; getting program to end if i enter 0 for num words,> 60 minutes,,lima,10/12/17 13:18,13:18:06,MAde sure hw was not cheating343,10/12/17 12:59,HW/Project,problem 3; my functions do not work ,16 - 30 minutes,,lima,10/12/17 13:22,13:22:33,hw3 and 4 questions