518,11/20/17 15:51,HW/Project,I have issues with recursion;,> 60 minutes,,daikon,11/20/17 16:25,16:25:11,help with recursive385,11/20/17 15:56,HW/Project,"my recursion function returns <reversed object at 0x104102550>"" and I don't know how to fix it""",6 - 15 minutes,,daikon,11/20/17 16:36,16:36:46,typos535,11/20/17 15:58,HW/Project,I'm having trouble with the recursion in Part 4,6 - 15 minutes,,daikon,11/20/17 16:39,16:39:37,algorithim problem285,11/20/17 15:58,HW/Project,i Can't figure out how to add numbers according to their height,31 - 60 minutes,,daikon,11/20/17 16:47,16:47:38,algorithim question164,11/20/17 16:01,HW/Project,Add list inside of a list and the index of a list inside of a list,31 - 60 minutes,,,,,requested again510,11/20/17 16:01,HW/Project,Need help with pascal's triangle,> 60 minutes,,daikon,11/20/17 16:53,16:53:27,algorithim about how to do it271,11/20/17 16:02,HW/Project,need help with base case for the 1st level in pascals triangle,6 - 15 minutes,,daikon,11/20/17 16:59,16:59:59,problem with eginning levels503,11/20/17 16:03,HW/Project,about the new e-mail ,> 60 minutes,,radish,11/20/17 17:03,17:03:08,nevermind340,11/20/17 16:13,HW/Project,I'm having trouble creating the base for the triangle ,16 - 30 minutes,,radish,11/20/17 17:03,17:03:33,student left503,11/20/17 16:16,About the email,About the email ,> 60 minutes,,,,,requested again376,11/20/17 16:16,HW/Project,I am having trouble understanding part 5 of the homework; specifically with how to create the next row;,6 - 15 minutes,,radish,11/20/17 17:04,17:04:24,Pascal's triangle273,11/20/17 16:24,HW/Project,hw6_part6;py ; having issues with list indexing,> 60 minutes,,radish,11/20/17 17:10,17:10:35,student left586,11/20/17 16:33,HW/Project,I am still stuck with problem 5 of hw6,16 - 30 minutes,,radish,11/20/17 17:11,17:11:02,Pascal's triangle235,11/20/17 16:51,HW/Project,Getting index out of range error when creating new row of pascal triangle with recursion,> 60 minutes,,radish,11/20/17 17:16,17:16:40,nevermind535,11/20/17 16:57,HW/Project,I'm having a bit of difficulty with my recursive case in Part 4,6 - 15 minutes,,radish,11/20/17 17:16,17:16:52,Recursive reverse string426,11/20/17 16:59,HW/Project,I'm having trouble with recursion; hw6,31 - 60 minutes,,radish,11/20/17 17:26,17:26:38,Pascal's triangle327,11/20/17 17:01,HW/Project,Am I able to use loops in recursion? I am trying to figure out how to print Pascal's Triangle recursively;,31 - 60 minutes,,radish,11/20/17 17:32,17:32:24,Pascal's triangle recursive518,11/20/17 17:05,HW/Project,I can't figure out the Palindrome problem; I think the base case is my issue;,16 - 30 minutes,,radish,11/20/17 17:38,17:38:23,Recursive reverse string516,11/20/17 17:08,HW/Project,not sure how to put recursion in with pascals's triangle,> 60 minutes,,radish,11/20/17 17:44,17:44:10,Recursive reverse string355,11/20/17 17:08,HW/Project,hw6 part5,6 - 15 minutes,,radish,11/20/17 17:54,17:54:48,Pascal's triangle looping376,11/20/17 17:11,HW/Project,Want more help on part 5 regarding how to produce the numbers for each row;,< 5 minutes,,radish,11/20/17 17:59,17:59:18,student left385,11/20/17 17:11,HW/Project,I'm doing hw6 part5 and get stuck at appending 2D list; ,16 - 30 minutes,,radish,11/20/17 17:59,17:59:47,student left414,11/20/17 17:12,HW/Project,I can not figure out how to add together the different indexes,31 - 60 minutes,,radish,11/20/17 17:59,17:59:58,Pascal's triangle looping586,11/20/17 17:17,HW/Project,HW 6 part 5,> 60 minutes,,,,,office hours over338,11/20/17 17:22,HW/Project,for part 6 loop problem,16 - 30 minutes,,,,,office hours over171,11/20/17 17:26,HW/Project,I'm having trouble creating my pascal function for part 5,31 - 60 minutes,,,,,office hours over264,11/20/17 17:27,HW/Project,recurssion on pascals triangle,16 - 30 minutes,,,,,office hours over285,11/20/17 17:27,HW/Project,i keep getting index out of range when i try to add numbers from different lists in a 2D list,> 60 minutes,,,,,office hours over456,11/21/17 9:57,HW/Project,I keep getting the maximum recursion depth exceeded error,> 60 minutes,,iceberg lettuce,11/21/17 9:57,9:57:35,Bad understanding of the function555,11/21/17 9:58,HW/Project,Help printing out 2D list to make a triangle,6 - 15 minutes,,iceberg lettuce,11/21/17 10:02,10:02:40,"end="""510,11/21/17 10:01,HW/Project,Need help with recursion for pascal's triangle,> 60 minutes,,iceberg lettuce,11/21/17 10:04,10:04:05,Didn't understand the pascal triangle; explaned logic233,11/21/17 10:01,HW/Project,I'm not sure if I'm doing recursion right; I'm having trouble returning the value I want;,31 - 60 minutes,,iceberg lettuce,11/21/17 10:14,10:14:35,Had in issue with understanding #1 had no base case452,11/21/17 10:24,HW/Project,problem 6 :adding each row to the levelList,> 60 minutes,,iceberg lettuce,11/21/17 10:31,10:31:40,wasn't using a for loop338,11/21/17 10:29,HW/Project,is my program fine to display 2D list?,> 60 minutes,,iceberg lettuce,11/21/17 10:42,10:42:23,Commenting questions510,11/21/17 10:34,HW/Project,Need help with recursion for pascal's triangle,6 - 15 minutes,,iceberg lettuce,11/21/17 10:45,10:45:27,Had 2 for loops552,11/21/17 10:40,HW/Project,type error,16 - 30 minutes,,iceberg lettuce,11/21/17 10:51,10:51:32,Not recursive; also said sum function was allowed for hw?376,11/21/17 10:40,HW/Project,I am on part 6 of the homework and I am unsure of where to even get started with my base cases and recursive cases;,< 5 minutes,,iceberg lettuce,11/21/17 10:55,10:55:27,Needed help with the recursive cases456,11/21/17 10:47,HW/Project,I'm not sure if I have my recursive functions commented properly;,6 - 15 minutes,,eggplant,11/21/17 10:57,10:57:05,Wanted to confimr his funtion header comments were acceptable233,11/21/17 10:48,HW/Project,trouble understanding recursion and I'm getting an error in hw6_part3 'int' object not callable ,31 - 60 minutes,,eggplant,11/21/17 10:58,10:58:25,He figured it out but had questions on reverseStr so I quickly answered them338,11/21/17 10:49,HW/Project,for HW6 PART 3; is fine to use 3 cases (include base case) in a recursive function?,> 60 minutes,,eggplant,11/21/17 11:03,11:03:27,He wanted to confirm that the amount of cases he was using were acceptable340,11/21/17 10:53,HW/Project,I'm confused on what the variable levelList is for part 6 of the homework,< 5 minutes,,eggplant,11/21/17 11:06,11:06:49,Struggling through pascal triangle recursively414,11/21/17 10:54,HW/Project,I do not know how to get my indexes to add up properly to create pascals triangle,31 - 60 minutes,,eggplant,11/21/17 11:11,11:11:54,"Had a single while loop; DId the math correctly but was only going row"" by ""row"""285,11/21/17 10:54,HW/Project,My program prints the wrong number of lists; (recursion),> 60 minutes,,eggplant,11/21/17 11:16,11:16:49,He was doing two recusive calls so it printed out an extra row452,11/21/17 10:58,HW/Project,leveList not updating in the main,6 - 15 minutes,,eggplant,11/21/17 11:24,11:24:40,She was reinitializing the list in the recusive function510,11/21/17 11:11,HW/Project,"My code shows error list index out of range""; """,6 - 15 minutes,,eggplant,11/21/17 11:34,11:34:48,She was comparing the columns of the row below in the row above resulting in a index out of range error575,11/21/17 11:16,HW/Project,"I don't understand why my part 3 and 4 are returning nonetype"" values""",31 - 60 minutes,,eggplant,11/21/17 11:43,11:43:34,student left376,11/21/17 11:18,HW/Project,I am having trouble understanding how the recursion should work in part 5;,6 - 15 minutes,,eggplant,11/21/17 11:44,11:44:06,nevermind426,11/21/17 11:20,HW/Project,hw6; im having trouble using recursion; Im getting a not subscriptable error,16 - 30 minutes,,eggplant,11/21/17 11:44,11:44:35,Student was overcomplicating the recusiveness of it547,11/21/17 11:20,Concept,I have my homework part 5 completed and function but I do not understand why something works on it; ,< 5 minutes,,eggplant,11/21/17 11:50,11:50:48,student left478,11/21/17 11:24,HW/Project,Output,> 60 minutes,,eggplant,11/21/17 11:51,11:51:18,Was getting an extra space he didn't want; I told him not to worry to much about it200,11/21/17 11:24,HW/Project,I am unsure how to construct a pascal triangle without using recursion,16 - 30 minutes,,eggplant,11/21/17 11:54,11:54:47,student left358,11/21/17 11:28,HW/Project,I'm not sure how to increment the symbol for the right triangle;,6 - 15 minutes,,eggplant,11/21/17 11:55,11:55:15,Figured it out but had questions about pascal (part 5)208,11/21/17 11:33,HW/Project,my code is functioning but i dont know if it truly meets the homework requirments ,16 - 30 minutes,,eggplant,11/21/17 12:02,12:02:40,He wanted to confirm if a while loop to print is okay123,11/21/17 11:44,HW/Project,Confused on using recursion for palindromes,16 - 30 minutes,,eggplant,11/21/17 12:04,12:04:38,Wondering if she was on the right track for palindrome376,11/21/17 11:49,HW/Project,Question regarding why my recursive function works;,< 5 minutes,,eggplant,11/21/17 12:11,12:11:56,Wanted to check what output of a recursive function means285,11/21/17 11:54,HW/Project,My program isnt printing the right number of columns and adding when i expect it to,> 60 minutes,,eggplant,11/21/17 12:16,12:16:58,Was traversing the entire 2D list for part6555,11/21/17 11:55,HW/Project,help printing pascal's triangle,16 - 30 minutes,,eggplant,11/21/17 12:22,12:22:07,Needed help printing out pascal triangle552,11/21/17 11:55,HW/Project,recursion functions,16 - 30 minutes,,eggplant,11/21/17 12:26,12:26:07,Stuck on equines one but realized what to do when I mentioned hailstone414,11/21/17 11:56,HW/Project,I don't know how to get my indexes to add up to make Pascal's triangle,16 - 30 minutes,,eggplant,11/21/17 12:28,12:28:50,Was trying to append to one list over and over again and it wasn't working570,11/21/17 12:00,HW/Project,Checking the recursive logic,31 - 60 minutes,,eggplant,11/21/17 12:36,12:36:17,student left510,11/21/17 12:00,HW/Project,Need help with indexing,16 - 30 minutes,,eggplant,11/21/17 12:36,12:36:39,She messed up her currLevel which is negatively affecting her pascal triangle426,11/21/17 12:05,HW/Project,hw6; i got confused again  (recursion),6 - 15 minutes,,eggplant,11/21/17 12:45,12:45:59,Pascal triangle working wanted to confirm everything and some things explained233,11/21/17 12:12,HW/Project,stuck on recursion function for part 4; not sure how to do base case,31 - 60 minutes,,eggplant,11/21/17 12:53,12:53:01,A bit rusty on string comprehension but he knew what to do with it340,11/21/17 12:13,HW/Project,I'm having trouble figuring out how to make pascal recursive;,16 - 30 minutes,,eggplant,11/21/17 12:57,12:57:57,He has the right idea just needs to deal with some out of bounds issues375,11/21/17 12:14,HW/Project,I'm stuck on how to get all the numbers inside the pascal triangle; ,16 - 30 minutes,,squash,11/21/17 12:59,12:59:51,student left358,11/21/17 12:15,HW/Project,I'm not sure how the list is going to be appending for my rows ,6 - 15 minutes,,squash,11/21/17 13:00,13:00:00,Helped lead them to a solution and how it would work224,11/21/17 12:16,HW/Project,Checking Part 5 and Part 6 Recursive case before submitting,< 5 minutes,,squash,11/21/17 13:05,13:05:40,nevermind117,11/21/17 12:21,HW/Project,Type error ,16 - 30 minutes,,squash,11/21/17 13:05,13:05:56,Fixed her summation function; added necessary formal parameters552,11/21/17 12:37,HW/Project,recursion function,16 - 30 minutes,,squash,11/21/17 13:12,13:12:19,Suggested using another parameter to keep track285,11/21/17 12:40,HW/Project,Index out of range error while trying to iterate over a list,> 60 minutes,,squash,11/21/17 13:18,13:18:49,student left362,11/21/17 12:43,HW/Project,renaming a file,< 5 minutes,,squash,11/21/17 13:18,13:18:58,Did a bunch of cp magic340,11/21/17 12:47,HW/Project,I'm having trouble with making the pyramid a 2D list,16 - 30 minutes,,squash,11/21/17 13:20,13:20:44,student left575,11/21/17 12:49,HW/Project,Using a 2D list in my part 6;;;and I am leaving campus soon so please get to meeee <3,> 60 minutes,,squash,11/21/17 13:20,13:20:50,student left246,11/21/17 12:51,HW/Project,Part 6- running wrong statement,31 - 60 minutes,,squash,11/21/17 13:21,13:21:04,student left535,11/21/17 12:58,HW/Project,I need help trying to implement the steps of Pascal's triangle into code in Part 5,6 - 15 minutes,,squash,11/21/17 13:21,13:21:17,Suggested a solution for pascals -- 2d lists229,11/21/17 13:01,HW/Project,adding the numbers in pascal's triangle,> 60 minutes,,squash,11/21/17 13:24,13:24:58,Suggested yet another solution for pascals and walked them through it358,11/21/17 13:15,HW/Project,Having trouble figuring out what to append within what while loop,6 - 15 minutes,,squash,11/21/17 13:29,13:29:29,student left233,11/21/17 13:19,HW/Project,i'm confused with the triangle in part 5; I have an empty 2d list and i'm not sure where to go from there,31 - 60 minutes,,squash,11/21/17 13:30,13:30:24,Helped them with pascals; current solution didn't work out414,11/21/17 13:21,HW/Project,I don't know how to add the indexes of my list using recursion,16 - 30 minutes,,squash,11/21/17 13:34,13:34:39,Suggested using a formal parameter362,11/21/17 13:21,HW/Project,need help fixing my hw6 part 5 code,31 - 60 minutes,,squash,11/21/17 13:39,13:39:36,Kind of;;; helped him?552,11/21/17 13:22,HW/Project,Recursion,31 - 60 minutes,,squash,11/21/17 13:45,13:45:10,Suggested string slicing285,11/21/17 13:28,HW/Project,My program isn't print as it should,> 60 minutes,,squash,11/21/17 13:46,13:46:54,Asked him to comment his code first before I try to fix it117,11/21/17 13:34,HW/Project,Pascal triangle 5,16 - 30 minutes,,squash,11/21/17 13:50,13:50:09,Worked with them to get the code to somewhat start;;?265,11/21/17 13:40,HW/Project,I don't know why my function keeps returning 'None',16 - 30 minutes,,,,,office hours over426,11/21/17 13:41,HW/Project,hw6; I'm missing a 1 at the top of my triangle; I don't know how to fix it;,16 - 30 minutes,,,,,office hours over117,11/21/17 13:43,HW/Project,Pascaal's triangle 5 ,16 - 30 minutes,,,,,office hours over188,11/21/17 13:47,HW/Project,index out of bounds error,> 60 minutes,,,,,office hours over188,11/21/17 14:03,HW/Project,Index out of bounds,> 60 minutes,,tomatillo ,11/21/17 14:03,14:03:34,Werd wrror with the index out of range 265,11/21/17 14:03,HW/Project,I do not know why my function is returning 'None',16 - 30 minutes,,tomatillo ,11/21/17 14:17,14:17:10,Added a parameter; would not take no for an answer 294,11/21/17 14:04,HW/Project,hw6_part6: I am not sure how to approach creating the pascal program recursively using the 3 parameters,> 60 minutes,,tomatillo ,11/21/17 14:26,14:26:01,Wanted to walk through his thought process for part 6281,11/21/17 14:05,HW/Project,When trying to create a right triangle i cannot get it to print more than one symbol on one line and if i do it only runs once  calling the symbol multiple times,31 - 60 minutes,,tomatillo ,11/21/17 14:30,14:30:55,Forgot the how the stack works with recursion 117,11/21/17 14:05,HW/Project,Pascal triangle 5 ,16 - 30 minutes,,tomatillo ,11/21/17 14:35,14:35:42,Confused on how to use the 2d list for pascals triangle 535,11/21/17 14:06,HW/Project,I still need help implementing the steps of Pascal's triangle,16 - 30 minutes,,tomatillo ,11/21/17 14:41,14:41:13,Pacals Traingle without recursion; was not sure how to start 292,11/21/17 14:08,HW/Project,I think Ineed a basic understanding of recursive functions,16 - 30 minutes,,tomatillo ,11/21/17 14:45,14:45:12,Forgot the how the stack works with recursion 508,11/21/17 14:26,Concept,I'm not sure how to create a function header for the recursive functions that are required for HW6; I am also not sure if some of the numbers I used should be constants or not;,16 - 30 minutes,,mango,11/21/17 14:54,14:54:07,constants and function header comments564,11/21/17 14:35,HW/Project,Not sure how to get the triangle to print correctly,31 - 60 minutes,,tomatillo ,11/21/17 14:54,14:54:09,Forgot the how the stack works with recursion 385,11/21/17 14:41,HW/Project,I use a 2D list for hw part5; but it doesn't work due to the index out of range and I don't know how to solve it ,16 - 30 minutes,,tomatillo ,11/21/17 14:56,14:56:18,Was using the 2dList in a very werid way 314,11/21/17 14:42,HW/Project,use recursion ,6 - 15 minutes,,mango,11/21/17 14:57,14:57:14,Computer died; talked about the pascal recursion318,11/21/17 14:58,HW/Project,I am having a problem with the case insensitive part of part 4;,31 - 60 minutes,,tomatillo ,11/21/17 15:00,15:00:45,Forgot that ;upper() and ;lower() are things 124,11/21/17 14:59,HW/Project,How do i create a full fibanocci sequence using a for loop?,> 60 minutes,,tomatillo ,11/21/17 15:02,15:02:43,Using the fib equation for part 5/6 could it work? I dont know 265,11/21/17 15:06,HW/Project,My program keeps giving me a non subcriptable error,16 - 30 minutes,,mango,11/21/17 15:06,15:06:29,Iterative solution to pascals329,11/21/17 15:09,HW/Project,I'm not quite sure whether my base cases are correct and I'm not sure how to correct my recursive cases;,> 60 minutes,,tomatillo ,11/21/17 15:09,15:09:51,Logical error in his recursive call in part6 564,11/21/17 15:10,HW/Project,How to add the ears and horns in the recursive case,31 - 60 minutes,,mango,11/21/17 15:14,15:14:17,unicorn horse counting281,11/21/17 15:11,HW/Project,my recursive triangle prints First In; First Out,6 - 15 minutes,,tomatillo ,11/21/17 15:17,15:17:24,Trainlge was prininting backwards; walked him through a stack 535,11/21/17 15:16,HW/Project,I need help printing the next level of Pascal's Triangle in Part 5,16 - 30 minutes,,mango,11/21/17 15:18,15:18:30,Blue screen of death; helped understand pascals463,11/21/17 15:16,HW/Project,201;hw6; for part 1  can't get it to iterate for the final time;,16 - 30 minutes,,tomatillo ,11/21/17 15:21,15:21:59,Walked him through the lab agian; he understood his error for part 1508,11/21/17 15:21,HW/Project,I am using 2 functions other than main in part 6 for hw6 (printing pascal's triangle recursively); I was wondering if what I was doing is allowed;,6 - 15 minutes,,tomatillo ,11/21/17 15:27,15:27:19,Wanted to check to see if his added Factorial() function is okay318,11/21/17 15:25,HW/Project,i am having trouble printing the triangle on part 2,31 - 60 minutes,,tomatillo ,11/21/17 15:30,15:30:02,Was using a different print function; told her to do it inside the recur func 343,11/21/17 15:26,HW/Project,#2; dont understand error,16 - 30 minutes,,tomatillo ,11/21/17 15:32,15:32:45,Walked her through her logic; told her to try and submit another request 294,11/21/17 15:27,HW/Project,my list for pascal's triangle is not updating,> 60 minutes,,tomatillo ,11/21/17 15:38,15:38:05,Did not create the 2d list correctly 579,11/21/17 15:30,HW/Project,CS 201; hw6-P6 ; code is giving error message saying ints are not subscriptable and i would like that explained if able,< 5 minutes,,mango,11/21/17 15:38,15:38:57,weird append219,11/21/17 15:34,HW/Project,my pascal() function is supposed to print pascals triangle until the users desired height; I am having out of index errors when creating a new cell of the triangle;,> 60 minutes,,tomatillo ,11/21/17 15:44,15:44:29,INdex out of range; told him to walk through the code 552,11/21/17 15:35,HW/Project,recurstion math,> 60 minutes,,mango,11/21/17 15:50,15:50:47,Help with iterative402,11/21/17 15:36,HW/Project,I don't understand how to apply recursion to hw6_part6,31 - 60 minutes,,tomatillo ,11/21/17 15:53,15:53:18,walked him througth their logic and help them understand the recursion 157,11/21/17 15:36,HW/Project,Having trouble conceptualizing the answer to problem 6,31 - 60 minutes,,mango,11/21/17 15:58,15:58:15,helped by tomatillo130,11/21/17 15:37,HW/Project,hw6pt6; how do i print without it being a list; mine is duplicating many numbers,> 60 minutes,,mango,11/21/17 15:58,15:58:55,printing stuff had to leave for class329,11/21/17 15:38,HW/Project,My program keeps telling me I have the wrong index when I'm pretty sure it is correct;,> 60 minutes,,pepper,11/21/17 16:00,16:00:46,student left238,11/21/17 15:45,HW/Project,Printing out a triangle; can't find out logic,31 - 60 minutes,,mango,11/21/17 16:00,16:00:57,student left354,11/21/17 15:47,HW/Project,Dont understand for loops; dont know how to use it for creating pascal's triangle,31 - 60 minutes,,pepper,11/21/17 16:01,16:01:33,Explained for loops477,11/21/17 15:49,HW/Project,the base case for part4 of hw6,16 - 30 minutes,,tomatillo ,11/21/17 16:01,16:01:50,told him to think about it like lab last week 319,11/21/17 15:51,HW/Project,Understanding the base cases for hw6_part6,16 - 30 minutes,,mango,11/21/17 16:01,16:01:52,Bootstrapping the recursion503,11/21/17 15:51,HW/Project,Could you please help me check the final results of the homework 6 ? Thank you very much  ,> 60 minutes,,ugli fruit,11/21/17 16:04,16:04:07,wanted to make sure he was validating input correctly414,11/21/17 15:57,HW/Project,I am having trouble understanding the movement of the elements through the different functions,16 - 30 minutes,,tomatillo ,11/21/17 16:06,16:06:23,Walk through her logic 205,11/21/17 15:59,HW/Project,I am unable to make my pascal triangle correctly; i cannot create the structure,31 - 60 minutes,,ugli fruit,11/21/17 16:07,16:07:57,needed some help getting started with the non-recursive version510,11/21/17 16:01,HW/Project,Need help with recursion for pascals triangle,31 - 60 minutes,,pepper,11/21/17 16:09,16:09:15,Getting out of range error and needed a return in base case579,11/21/17 16:01,HW/Project,"CMSC 201;TypeError: can only concatenate list (not int"") to list; trouble understanding error msg""",6 - 15 minutes,,tomatillo ,11/21/17 16:12,16:12:32,Werid error that i could not find 552,11/21/17 16:02,HW/Project,recursion math,31 - 60 minutes,,ugli fruit,11/21/17 16:18,16:18:59,was not accounting for different num of horns/ears on the equines; will need more help later535,11/21/17 16:09,HW/Project,I still need help printing the next level of Pascal's triangle,6 - 15 minutes,,tomatillo ,11/21/17 16:21,16:21:53,We started from scratch for part 6 245,11/21/17 16:10,HW/Project,For question number 1; my recursion totals are slightly off; this a logic issue,16 - 30 minutes,,pepper,11/21/17 16:22,16:22:25,Needed to edit base case543,11/21/17 16:13,HW/Project,I am having difficulty passing variables to the recursive function,31 - 60 minutes,,pepper,11/21/17 16:26,16:26:51,Needed a base case354,11/21/17 16:19,HW/Project,pascal's triangle (not checking above addition),16 - 30 minutes,,tomatillo ,11/21/17 16:31,16:31:02,Wasnt sure on how to use a 2d list 477,11/21/17 16:19,HW/Project,hw6 part6 the triangle is just a list of 1s,16 - 30 minutes,,ugli fruit,11/21/17 16:33,16:33:38,wasn't correctly using the previous row to generate the current row of the triangle319,11/21/17 16:21,HW/Project,hw6_part6;py; index out of bounds error,6 - 15 minutes,,tomatillo ,11/21/17 16:38,16:38:22,Not really much to add note wise; really stupid error that took me way to long to find123,11/21/17 16:30,HW/Project,Confused on pascal's triangle without recursion,> 60 minutes,,ugli fruit,11/21/17 16:43,16:43:00,needed help getting started327,11/21/17 16:34,HW/Project,My program seemingly stopped working; Is their a way to retrieve the last submitted file?,31 - 60 minutes,,pepper,11/21/17 16:46,16:46:15,Issues with submissions246,11/21/17 16:35,HW/Project,part 2 if statements not working,16 - 30 minutes,,ugli fruit,11/21/17 16:58,16:58:37,"had an extra space in her return base case (return  "")"""552,11/21/17 16:35,HW/Project,function math,31 - 60 minutes,,ugli fruit,11/21/17 17:03,17:03:17,made some more progress on the unicorn problem318,11/21/17 16:38,HW/Project,I have a question about the triangle in part 5; I understand the triangle i just dont know how to code it;,31 - 60 minutes,,ugli fruit,11/21/17 17:07,17:07:31,needed help getting started; advised to start by building empty 2d list205,11/21/17 16:40,HW/Project,Do not know how to use recursion to reverse a string; I am also having issues understanding how to have the correct casing in the reversed string,16 - 30 minutes,,ugli fruit,11/21/17 17:13,17:13:29,Helped think through algorithm414,11/21/17 16:42,HW/Project,I am having trouble sending the current level to the pascal function,16 - 30 minutes,,ugli fruit,11/21/17 17:20,17:20:57,student left329,11/21/17 16:48,HW/Project,My program is incorrectly indexing under changing conditions,> 60 minutes,,ugli fruit,11/21/17 17:21,17:21:49,needed to move base cases up535,11/21/17 16:53,HW/Project,I'm getting a list out of range error for the rows in Part 5,6 - 15 minutes,,ugli fruit,11/21/17 17:25,17:25:54,student left510,11/21/17 17:00,HW/Project,My code prints out an empty list in the beginning of pascal's triangle;,6 - 15 minutes,,ugli fruit,11/21/17 17:26,17:26:42,couldn't find the bug without restructuring the program; output looks correct when pretty printed327,11/21/17 17:01,HW/Project,"I am having a None Type"" error in my recursive function; What should I be returning; if anything at all?""",31 - 60 minutes,,ugli fruit,11/21/17 17:39,17:39:29,was trying to append output of recursive function that didn't return a value543,11/21/17 17:10,HW/Project,the program output is printing multiple times,16 - 30 minutes,,ugli fruit,11/21/17 17:47,17:47:42,was printing list in recursive function instead of in main414,11/21/17 17:14,HW/Project,I can not figure out how to get my recursive function to add together the proper numbers,16 - 30 minutes,,ugli fruit,11/21/17 17:50,17:50:57,helped set up the function call in main