287,10/26/17 14:32,HW/Project,I need help constructing printSongs function,< 5 minutes,,vanilla,10/26/17 14:49,14:49:54,Discussing idea of how to approach printSongs()117,10/26/17 14:35,HW/Project,column to string ,16 - 30 minutes,,squash,10/26/17 14:51,14:51:44,Had a problem with input statement -- fixed with concatenating the message174,10/26/17 14:39,HW/Project,Looking over code and returning value to main,6 - 15 minutes,,vanilla,10/26/17 14:52,14:52:53,nevermind555,10/26/17 14:39,HW/Project,check if my search function is correct,6 - 15 minutes,,vanilla,10/26/17 14:53,14:53:31,Clarifying printSongs() and songToString()429,10/26/17 14:44,HW/Project,I still have no idea what is wrong with my search function,> 60 minutes,,squash,10/26/17 14:54,14:54:30,Missing a tab460,10/26/17 14:45,HW/Project,My search and create playlist aren  t doing what I expect them to;,> 60 minutes,,squash,10/26/17 14:56,14:56:16,Comparing int with string130,10/26/17 14:52,HW/Project,Proj1; I need help in creating my search function; I am stuck on what to do for this part; I get what it does but don  t know how to implement it and also how do i do the createPLaylist function,> 60 minutes,,vanilla,10/26/17 14:57,14:57:43,Guided him on how he should start525,10/26/17 14:54,HW/Project,Input validation does not stop after sentinel is entered,> 60 minutes,,fiddlehead,10/26/17 15:02,15:02:05,whoops; no note117,10/26/17 14:56,HW/Project,Search function,6 - 15 minutes,,zucchini,10/26/17 15:07,15:07:50,wanted to explain her search function;;;sorta just sat and listened130,10/26/17 15:03,HW/Project,Proj1; I need help in finishing my search function; and the createPlaylist function I am stuck on what to do for this part;,> 60 minutes,,fiddlehead,10/26/17 15:08,15:08:18,fishing174,10/26/17 15:05,HW/Project,Create a playlist i finished my code everything works just need some one to look at it,31 - 60 minutes,,fiddlehead,10/26/17 15:09,15:09:32,just wanted confirmation on whether his project was done correctly555,10/26/17 15:11,HW/Project,printing songs; will only print last song,6 - 15 minutes,,zucchini,10/26/17 15:14,15:14:19,songToString working with 2d list338,10/26/17 15:11,HW/Project,How can I use def search?,> 60 minutes,,fiddlehead,10/26/17 15:16,15:16:13,kind of hard to understand what his questions were but understanding the flow of the program?292,10/26/17 15:14,HW/Project,I have an infintie while loop i can  t quite seem to diagnose,31 - 60 minutes,,zucchini,10/26/17 15:22,15:22:28,Calling the function one too many times115,10/26/17 15:16,HW/Project,Everything is broken; Nothing works; I  m going to fail this class; I  m going to fail life; I will never recover; Don  t even bother with me; More specifically; I  m nearly done but my playlist function does not work; ,> 60 minutes,,fiddlehead,10/26/17 15:27,15:27:46,His return statement was in his while loop246,10/26/17 15:18,HW/Project,search function,> 60 minutes,,zucchini,10/26/17 15:36,15:36:30,explaining searching function; and fixing call153,10/26/17 15:20,HW/Project,My program won  t take -1(the sentinel) as a valid input and won  t exit a while loop;,16 - 30 minutes,,fiddlehead,10/26/17 15:41,15:41:09,his input validation was not working correctly117,10/26/17 15:26,HW/Project,Search function,6 - 15 minutes,,zucchini,10/26/17 15:55,15:55:22,student left130,10/26/17 15:36,HW/Project,Proj1; I am having logical errors; it  s infinitely asking for user input and doesn  t exit or prints the result; and doesn  t go on to the next part,> 60 minutes,,jicama,10/26/17 16:11,16:11:21,Tried to compare int to string535,10/26/17 15:41,HW/Project,I need help getting started with songToString() in the project,6 - 15 minutes,,jicama,10/26/17 16:16,16:16:47,student left502,10/26/17 15:41,HW/Project,Skip me; I just want to work on it in here and ask a question if one comes up,> 60 minutes,,jicama,10/26/17 16:19,16:19:00,nevermind171,10/26/17 15:42,HW/Project,getting an error for my songToString function,> 60 minutes,,jicama,10/26/17 16:19,16:19:38,Helped with shallow vs deep copy203,10/26/17 15:46,HW/Project,I am having trouble defining the printSongs function and the getValidInput function;,6 - 15 minutes,,jicama,10/26/17 16:26,16:26:01,Helped with understanding parameters355,10/26/17 15:53,HW/Project,search,> 60 minutes,,jicama,10/26/17 16:24,16:24:46,student left510,10/26/17 15:53,HW/Project,Need help with creating a playlist,> 60 minutes,,jicama,10/26/17 16:32,16:32:24,Incremented for while loop in wrong place552,10/26/17 15:56,HW/Project,search function; value error,> 60 minutes,,jicama,10/26/17 16:47,16:47:02,student left359,10/26/17 15:58,HW/Project,I am not sure on how to updating a 2D list (with the mutability rules);,16 - 30 minutes,,jicama,10/26/17 16:47,16:47:24,nevermind478,10/26/17 15:59,HW/Project,search out of range,31 - 60 minutes,,jicama,10/26/17 16:48,16:48:10,Understanding where to print certain statements502,10/26/17 16:01,HW/Project,Is my getValidInput() made correctly; and how is colToString relevant?,31 - 60 minutes,,jicama,10/26/17 16:56,16:56:10,Walked through the concept of search130,10/26/17 16:06,HW/Project,Proj1; I am having logical errors; it  s infinitely asking for user input and doesn  t exit or prints the result; and doesn  t go on to the next part,> 60 minutes,,,,,requested again338,10/26/17 16:07,HW/Project,How can I make a while loop in def search?,> 60 minutes,,jicama,10/26/17 17:03,17:03:53,Helped with understanding methods for strings and debugging460,10/26/17 16:07,HW/Project,My create playlist isn  t working the way I think it should,31 - 60 minutes,,cacao,10/26/17 17:06,17:06:16,trying to fix something broke something else575,10/26/17 16:13,HW/Project,I think my getValidInput function has en error because I am not getting the right output,31 - 60 minutes,,cacao,10/26/17 17:11,17:11:55,student left115,10/26/17 16:13,HW/Project,I just have one teeny tiny question: How do I code in python?,6 - 15 minutes,,jicama,10/26/17 16:44,16:44:53,nevermind246,10/26/17 16:15,HW/Project,Error that I don  t understand,16 - 30 minutes,,cacao,10/26/17 17:12,17:12:02,usin colToString wrong; among other things311,10/26/17 16:27,HW/Project,How should we loop the search function?,31 - 60 minutes,,jicama,10/26/17 17:12,17:12:43,Help with understanding search function130,10/26/17 16:33,HW/Project,Proj1; I was able to figure out and bypass the looping but now it  s giving me an empty string result and doesn  t go bakc to main menu,> 60 minutes,,,,,requested again292,10/26/17 16:35,HW/Project,Im having trouble structuring my main function,16 - 30 minutes,,kale,10/26/17 17:22,17:22:55,return values510,10/26/17 16:36,HW/Project,Need help with creating playlist,31 - 60 minutes,,jicama,10/26/17 17:26,17:26:41,Helped with conceptually understanding create playlist536,10/26/17 16:39,HW/Project,CreatePlaylist function and how to set up,> 60 minutes,,jicama,10/26/17 17:32,17:32:38,student left502,10/26/17 16:39,HW/Project,colToString() properly set up? I don  t know how to search a string for specific words ,16 - 30 minutes,,,,,requested again140,10/26/17 16:48,HW/Project,Im having trouble deciding how to approach a function;,31 - 60 minutes,,kale,10/26/17 17:28,17:28:31,songToString235,10/26/17 16:50,HW/Project,Verifying whether you need to implement songToString function in printSongs function or in main,> 60 minutes,,jicama,10/26/17 17:33,17:33:03,Helped with debugging130,10/26/17 17:18,HW/Project,Proj1; how do i print the results? now it  s giving me an empty string result and doesn  t go back to main menu and loops over the displayoptions infinitely,> 60 minutes,,kale,10/26/17 17:39,17:39:07,returning in the middle of a loop460,10/26/17 17:19,HW/Project,the create playlist isn  t working as I expect it to,31 - 60 minutes,,jicama,10/26/17 17:40,17:40:52,Helped with understanding how to debug478,10/26/17 17:19,HW/Project,my if statement,16 - 30 minutes,,jicama,10/26/17 17:45,17:45:14,Debugged conditional373,10/26/17 17:29,HW/Project,I am not sure when to use strings or constants;,16 - 30 minutes,,jicama,10/26/17 17:48,17:48:10,Asked if certain prompts need to be constants375,10/26/17 17:36,HW/Project,I  m having trouble how to start a function that creates a playlist;,6 - 15 minutes,,jicama,10/26/17 17:52,17:52:53,139,10/26/17 17:48,HW/Project,Do we have to match the spacing of the sample output?,< 5 minutes,,jicama,10/26/17 17:58,17:58:00,Suggested how to debug510,10/26/17 17:53,HW/Project,Need help to create a playlist function,31 - 60 minutes,,lima,10/26/17 18:05,18:05:05,error with dimension123,10/26/17 17:56,HW/Project,Does my function have to be exact as the one provided by cacao,> 60 minutes,,kale,10/26/17 18:14,18:14:41,fixing returns to fit function headers130,10/26/17 18:03,HW/Project,"Proj1;now everything is working and printing but it  s printing incorrectly; how do i tell it to stop when something is met? and also how do i print it as a string"" rather than [string]?""",> 60 minutes,,lima,10/26/17 18:16,18:16:14,a few problems lol246,10/26/17 18:04,HW/Project,Pass 1D list into printSongs,31 - 60 minutes,,kale,10/26/17 18:24,18:24:20,songToString535,10/26/17 18:06,HW/Project,I need help corresponding the ints to their respective strings,6 - 15 minutes,,lima,10/26/17 18:27,18:27:45,didn  t understand print statements373,10/26/17 18:07,HW/Project,I am having trouble completing search function,> 60 minutes,,lima,10/26/17 18:31,18:31:29,problem with playlist vs search287,10/26/17 18:10,HW/Project,need help with helper function,< 5 minutes,,lima,10/26/17 18:40,18:40:06,student left422,10/26/17 18:13,HW/Project,I don  t have the needed project design file for project1 (201) so i  m basically winging it; I need the file and help please; ,31 - 60 minutes,,lima,10/26/17 18:40,18:40:55,couldnt access design document lol117,10/26/17 18:14,HW/Project,song to string ,6 - 15 minutes,,lima,10/26/17 18:43,18:43:33,print erro311,10/26/17 18:15,HW/Project,Search function?,31 - 60 minutes,,lima,10/26/17 18:52,18:52:20,project problems311,10/26/17 18:24,HW/Project,Duration and tempo?,31 - 60 minutes,,,,,office hours over203,10/26/17 18:30,HW/Project,My getValidInput function is not exiting when the quit constant is entered,6 - 15 minutes,,,,,office hours over117,10/26/17 18:32,HW/Project,song to string ,31 - 60 minutes,,,,,requested again117,10/27/17 9:59,HW/Project,reprompting,16 - 30 minutes,,mango,10/27/17 9:59,9:59:44,Help with printing555,10/27/17 10:00,HW/Project,create playlist not returning properly,6 - 15 minutes,,mango,10/27/17 10:05,10:05:32,infinite loop292,10/27/17 10:03,HW/Project,i need help thinking through the search function for the project;  I also need to get my printSongs functions to return a value so i can feed it in as a formal parameter in the function for search;,31 - 60 minutes,,berry,10/27/17 10:07,10:07:42,Helped to store songs in a variable in main546,10/27/17 10:09,HW/Project,My program isn  t incrementing through the search function correctly; It only gives the information from the first song that meets the criteria;,> 60 minutes,,berry,10/27/17 10:13,10:13:32,She created her own function and I advised her to use print statements because it was trying to replicate printSongs 224,10/27/17 10:16,HW/Project,Figuring out how to create a playlist,16 - 30 minutes,,mango,10/27/17 10:16,10:16:58,differences between the playlist and search functions117,10/27/17 10:21,HW/Project,reprompting: variable passing,6 - 15 minutes,,mango,10/27/17 10:22,10:22:23,When to ask for information for the input in the big while loop552,10/27/17 10:22,HW/Project,playlist function,16 - 30 minutes,,berry,10/27/17 10:23,10:23:20,Coundn  t find the issue; Told him to debug555,10/27/17 10:28,HW/Project,Issue reprompting user when not sentinel,6 - 15 minutes,,mango,10/27/17 10:28,10:28:48,using get valid int properly194,10/27/17 10:33,HW/Project,It  s already done; how does it look?,> 60 minutes,,mango,10/27/17 10:35,10:35:38,coding standards questions552,10/27/17 10:33,HW/Project,function returns nothing or doesn  t follow other functions,16 - 30 minutes,,berry,10/27/17 10:34,10:34:25,He just used print() and not the function117,10/27/17 10:38,HW/Project,ordering reprompt ,6 - 15 minutes,,mango,10/27/17 10:38,10:38:34,Putty broke as soon as I got there; had a mispelling in a function call as the error555,10/27/17 10:47,HW/Project,Check printSong and stringToSong functions,6 - 15 minutes,,berry,10/27/17 10:47,10:47:38,Conceptualized how SongToString is useful and what was supposed to be inputted to printSOngs350,10/27/17 10:48,HW/Project,I dont understand how to use the sentinel value in a loop,> 60 minutes,,mango,10/27/17 10:48,10:48:58,Using the wrong constant in getValidInt as minimum value117,10/27/17 10:52,HW/Project,Duration/Tempo,6 - 15 minutes,,mango,10/27/17 10:52,10:52:33,help with handling different cases for duration tempo552,10/27/17 10:53,HW/Project,playlist function error,31 - 60 minutes,,berry,10/27/17 10:54,10:54:48,His indexing is off426,10/27/17 10:56,HW/Project,I have a result list in a function printing out; however i need to make a function that converts the list in to string but idk how?,31 - 60 minutes,,mango,10/27/17 10:58,10:58:56,how make the string 575,10/27/17 10:56,HW/Project,mySearch() is identifying the right matches but when it comes to printing the full song information; the full information is not printing out,> 60 minutes,,pepper,10/27/17 10:59,10:59:48,Needed finalString += ;;;; was re-writing finalString in printing songs355,10/27/17 10:57,HW/Project,debugging,> 60 minutes,,lima,10/27/17 11:00,11:00:47,Search problems171,10/27/17 10:58,HW/Project,My printSongs function is not working for tempo; duration and year ,> 60 minutes,,pepper,10/27/17 11:07,11:07:00,Needed to switch order of comparison and cast year to a float477,10/27/17 11:00,HW/Project,For proj1 I can  t access the songs;csv file through the 2DList function,6 - 15 minutes,,lima,10/27/17 11:12,11:12:37,didn  t understand filename343,10/27/17 11:01,HW/Project,main() function is not working,16 - 30 minutes,,lima,10/27/17 11:15,11:15:08,didn  t understand how main will work414,10/27/17 11:07,HW/Project,I can   t figure out how to iterate over the 2D list,6 - 15 minutes,,pepper,10/27/17 11:21,11:21:56,Confused index and col575,10/27/17 11:07,HW/Project,Why doe my slicing for [0; length] not work to make playlist the custom amount?,> 60 minutes,,lima,10/27/17 11:22,11:22:07,Used comma in range578,10/27/17 11:09,HW/Project,Error messages and loops,31 - 60 minutes,,lima,10/27/17 11:27,11:27:44,Aesthetics555,10/27/17 11:15,HW/Project,Help understanding songToString and printSongs functions; confused between the two,6 - 15 minutes,,pepper,10/27/17 11:28,11:28:44,Confused on purpose of functions350,10/27/17 11:15,HW/Project,I need on the search function in the project,31 - 60 minutes,,pepper,10/27/17 11:31,11:31:59,Didn  t call the function that created the 2D list355,10/27/17 11:23,HW/Project,debugging createPlaylist,> 60 minutes,,pepper,10/27/17 11:42,11:42:24,Needed 2 conditions in while loop510,10/27/17 11:21,HW/Project,I am having issue pulling the data out when the user inputs duration or tempo,> 60 minutes,,lima,10/27/17 11:46,11:46:07,few different print problems477,10/27/17 11:26,HW/Project,The program is saying that my list indexing is out of range when it shouldn  t be,6 - 15 minutes,,pepper,10/27/17 11:55,11:55:54,student left343,10/27/17 11:28,Lab,not sure what function to use,6 - 15 minutes,,lima,10/27/17 11:54,11:54:19,search vs playlist question292,10/27/17 11:28,HW/Project,I need help understanding how to append to an empty 2d list,16 - 30 minutes,,pepper,10/27/17 11:56,11:56:38,Thought they needed to append to 2D list instead of append entire row to list575,10/27/17 11:40,HW/Project,I thought my slicing had been fixed but it is giving problems again,6 - 15 minutes,,,,,office hours over246,10/27/17 11:41,HW/Project,concept of create playlist function and print songs function,31 - 60 minutes,,,,,office hours over552,10/27/17 11:46,HW/Project,slicing in a function,16 - 30 minutes,,,,,office hours over578,10/27/17 11:52,HW/Project,Restarting program,< 5 minutes,,,,,office hours over228,10/27/17 11:53,HW/Project,coding standards,6 - 15 minutes,,,,,office hours over414,10/27/17 11:56,HW/Project,Issues with iterating over the 2D list,16 - 30 minutes,,,,,office hours over552,10/27/17 12:01,HW/Project,invalid input in functions,> 60 minutes,,,,,office hours over578,10/27/17 13:01,HW/Project,while loops,< 5 minutes,,lima,10/27/17 13:08,13:08:57,syntax problems355,10/27/17 13:01,HW/Project,project,> 60 minutes,,nectarine,10/27/17 13:03,13:03:08,index a string then casting to float575,10/27/17 13:01,HW/Project,Slicing for my playlist() is giving problems,31 - 60 minutes,,nectarine,10/27/17 13:15,13:15:47,whoops; no note246,10/27/17 13:01,HW/Project,create playlist function,> 60 minutes,,lima,10/27/17 13:25,13:25:34,dindt understand function552,10/27/17 13:01,HW/Project,input validation statements,6 - 15 minutes,,nectarine,10/27/17 13:25,13:25:49,confused on error messages in functions112,10/27/17 13:01,HW/Project,submitting; does everything have to be in the same folder,6 - 15 minutes,,nectarine,10/27/17 13:28,13:28:46,student left292,10/27/17 13:01,HW/Project,I need helo integrating my song to string and print song function,16 - 30 minutes,,nectarine,10/27/17 13:28,13:28:58,returning non-existent var381,10/27/17 13:02,HW/Project,question about error in getValidInput function,16 - 30 minutes,,nectarine,10/27/17 13:36,13:36:06,student left171,10/27/17 13:02,HW/Project,my createPlaylist function is not working,> 60 minutes,,nectarine,10/27/17 13:36,13:36:24,wasn  t looping through list343,10/27/17 13:11,HW/Project,main is not working; a loop in my main is infinite,31 - 60 minutes,,lima,10/27/17 13:38,13:38:16,error checking problem510,10/27/17 13:17,HW/Project,Need help with printing specific columns,> 60 minutes,,lima,10/27/17 13:43,13:43:03,print songs confusion350,10/27/17 13:19,HW/Project,I need help with some functions; like songToString and createPlaylist,31 - 60 minutes,,nectarine,10/27/17 13:45,13:45:57,song to string is pretty printing529,10/27/17 13:21,HW/Project,Need help checking that my forwatermeloning is correct; for project 1,> 60 minutes,,nectarine,10/27/17 13:48,13:48:16,you dun good219,10/27/17 13:25,HW/Project,I am having trouble with a input validation function; The function takes in a prompt; a minimum allowed value; and a maximum allowed value; When the user input is not valid; the function needs to re prompt the user; My function fails at re prompting and doesn  t return a value if it is valid properly;,> 60 minutes,,lima,10/27/17 13:48,13:48:32,Validinput problem228,10/27/17 13:30,HW/Project,coding standards,6 - 15 minutes,,nectarine,10/27/17 13:49,13:49:39,you dun good140,10/27/17 13:30,HW/Project,My program isn  t going into the second part of the while loop for the create playlist function;,> 60 minutes,,nectarine,10/27/17 13:52,13:52:12,some confusion with create playlist 355,10/27/17 13:33,HW/Project,debugging,> 60 minutes,,lima,10/27/17 13:54,13:54:28,a bunch of prblems tbh580,10/27/17 13:41,HW/Project,I don  t know how to write function search in project 1;,31 - 60 minutes,,grape,10/27/17 14:06,14:06:14,student left564,10/27/17 13:43,HW/Project,How to work with search(),31 - 60 minutes,,grape,10/27/17 14:08,14:08:38,search logic284,10/27/17 13:44,HW/Project,Please look at my code and make sure I am following directions; :),6 - 15 minutes,,olive,10/27/17 14:10,14:10:59,checking for coding standards218,10/27/17 13:46,HW/Project,Need help distinguishing the column choices for my def create function compared with my def search function;,31 - 60 minutes,,grape,10/27/17 14:11,14:11:52,choices for playlist columns479,10/27/17 13:47,HW/Project,CreatePlaylist is returning none when it comes to error checking,16 - 30 minutes,,olive,10/27/17 14:12,14:12:42,not returning from getValidInput381,10/27/17 13:50,HW/Project,Question about setting up create playList function,> 60 minutes,,olive,10/27/17 14:14,14:14:56,indexing incorrectly503,10/27/17 13:52,HW/Project,compare the project to the previous design document ,> 60 minutes,,olive,10/27/17 14:18,14:18:17,help with function headers117,10/27/17 13:55,HW/Project,Search song ,6 - 15 minutes,,grape,10/27/17 14:18,14:18:46,student left 350,10/27/17 13:57,HW/Project,I need help on when to call a function;,16 - 30 minutes,,grape,10/27/17 14:20,14:20:09,Confusion about song to string546,10/27/17 14:00,HW/Project,My program gets stuck within the search function; It fails to go into an if statement that is for Duration and Tempo; ,31 - 60 minutes,,olive,10/27/17 14:20,14:20:36,looping structure139,10/27/17 14:01,HW/Project,Do I have a sufficient amount of comments?,6 - 15 minutes,,grape,10/27/17 14:26,14:26:05,checking comments318,10/27/17 14:04,HW/Project,Im on the search function and I dont think i understand the question because I made a 2d list but what am I to do with it? Should I append things? HELP Please,> 60 minutes,,olive,10/27/17 14:27,14:27:47,thinking through search510,10/27/17 14:07,HW/Project,Need help with getting to search with duration and tempo,> 60 minutes,,grape,10/27/17 14:29,14:29:22,whoops; no note503,10/27/17 14:07,HW/Project,compare the project to the previous design document ,> 60 minutes,,,,,requested again502,10/27/17 14:08,HW/Project,My program does not print out the search results for search(),16 - 30 minutes,,olive,10/27/17 14:31,14:31:15,confused about colToString381,10/27/17 14:14,HW/Project,Question about search funtion,> 60 minutes,,grape,10/27/17 14:32,14:32:38,basically spelling issue lol460,10/27/17 14:15,HW/Project,I just wanted to make sure if my comment were acceptable,6 - 15 minutes,,olive,10/27/17 14:36,14:36:01,checking comments415,10/27/17 14:18,HW/Project,Need to ask about an operator; if i can use it or not,31 - 60 minutes,,grape,10/27/17 14:36,14:36:39,book keeping140,10/27/17 14:21,HW/Project,One of the prompts printing twice before it moves on,> 60 minutes,,olive,10/27/17 14:37,14:37:38,prompt in display accidentally218,10/27/17 14:22,HW/Project,Need help using search() function to my createPlaylist() function and returning based on the length;,31 - 60 minutes,,olive,10/27/17 14:40,14:40:23,passing choice into create item list219,10/27/17 14:26,HW/Project,my getValidInput function sometimes prints the valid input but fails to return the value to be called later;  ,> 60 minutes,,grape,10/27/17 14:40,14:40:24,taking input in coltostring414,10/27/17 14:31,0,I can not get my program to return the song list,16 - 30 minutes,,grape,10/27/17 14:46,14:46:19,not casting value in search 350,10/27/17 14:34,HW/Project,songToString function,6 - 15 minutes,,olive,10/27/17 14:47,14:47:38,songToString510,10/27/17 14:47,HW/Project,Need help with duration; tempo and year options in search function,> 60 minutes,,grape,10/27/17 14:53,14:53:30,duration and tempo >= not ==564,10/27/17 14:48,HW/Project,I have an error where it was working earlier,6 - 15 minutes,,olive,10/27/17 14:59,14:59:05,debugging136,10/27/17 14:48,HW/Project,Comments/Whitespace,< 5 minutes,,berry,10/27/17 15:08,15:08:23,commenting questions546,10/27/17 14:48,HW/Project,When indexing through createPlaylist function; I receive the error list index out of range;,6 - 15 minutes,,berry,10/27/17 15:09,15:09:50,length of list vs asked length218,10/27/17 14:55,HW/Project,Not sure how to control the length of returned list;,16 - 30 minutes,,berry,10/27/17 15:12,15:12:33,choice is an interger not string224,10/27/17 15:00,HW/Project,Fixing my while loops and decision statements for my playlist function,> 60 minutes,,berry,10/27/17 15:21,15:21:16,used the wrong constant and returning NONE320,10/27/17 15:03,HW/Project,I  m confused on how to properly implement a nested function ( search( ) ) within my program;,6 - 15 minutes,,berry,10/27/17 15:32,15:32:21,understanding how to use search song479,10/27/17 15:04,HW/Project,I need help with multiple small issues with different functions,> 60 minutes,,berry,10/27/17 15:39,15:39:01,student left502,10/27/17 15:06,HW/Project,search() having trouble printing out songs; not sure why,31 - 60 minutes,,berry,10/27/17 15:39,15:39:18,comparing int with a string219,10/27/17 15:11,HW/Project,my column choice keeps looping when running my search function when it is only meant to prompt once,> 60 minutes,,berry,10/27/17 15:44,15:44:47,comparing int with a stirng292,10/27/17 15:15,HW/Project,My search program is not casting as string so I can;t concatenate; ,16 - 30 minutes,,quince,10/27/17 15:50,15:50:30,helped with when to cast to a string 350,10/27/17 15:18,HW/Project,I dont know how to use printSongs function,16 - 30 minutes,,berry,10/27/17 15:52,15:52:42,case sensitive414,10/27/17 15:19,HW/Project,I can not get my program to return the song list,6 - 15 minutes,,quince,10/27/17 15:55,15:55:42,helped with ways to debug 140,10/27/17 15:20,HW/Project,My final output is having a logical error,31 - 60 minutes,,berry,10/27/17 15:56,15:56:04,student left381,10/27/17 15:21,HW/Project,Question about creating playlist function,> 60 minutes,,berry,10/27/17 15:58,15:58:58,whoops; no note502,10/27/17 15:27,HW/Project,search() not printing; not sure why,31 - 60 minutes,,quince,10/27/17 15:59,15:59:09,diff between while and if 434,10/27/17 15:28,HW/Project,The output the program is not what I want; I am stuck,16 - 30 minutes,,mango,10/27/17 16:00,16:00:37,help with playlist funct564,10/27/17 15:32,HW/Project,How to get the 2d list to print like the sample output,16 - 30 minutes,,quince ,10/27/17 16:01,16:01:57,helped which fxn to call for  printing 