Username,Timestamp,Events,Time Spent,Time Helped
316,2/6/2017 14:24,HW1,3,Trying to cast string to int
227,2/7/2017 12:42,HW1,5,Needed def main():/main()
184,2/7/2017 13:20,HW1,3,Needed commas seperating string and variables
334,2/7/2017 13:23,HW1,1,
337,2/7/2017 13:25,LAB2,2,
334,2/7/2017 13:29,OTHERS,1,
137,2/7/2017 14:42,HW1,1,Student left
151,2/7/2017 14:54,HW1,3,
151,2/7/2017 15:27,HW1,2,
151,2/7/2017 15:39,HW1,2,Help with basic concepts (had missed class?)
151,2/8/2017 14:22,HW1,3,Help debugging
184,2/8/2017 14:47,HW1,2,Syntax and casting
151,2/8/2017 14:56,HW1,2,Print syntax
215,2/8/2017 15:02,HW1,2,GL directory issues
111,2/8/2017 15:13,HW1,3,Casting input to integer
320,2/8/2017 15:44,HW1,3,
160,2/9/2017 12:06,HW1,2,Help using ITE 240 computer
130,2/9/2017 14:37,HW1,3,Needed help with basically everything
130,2/9/2017 15:40,HW1,2,"GL/emacs help, how to get started on hw1_part2"
253,2/9/2017 15:59,OTHERS,3,GL/terminal help
337,2/9/2017 16:36,HW1,3,Wanted confirmation that program worked correctly
337,2/9/2017 17:22,HW1,4,Wanted confirmation that program worked correctly
337,2/9/2017 17:29,OTHERS,1,Said nevermind as soon as I stood up
158,2/10/2017 10:13,HW1,2,Wanted confirmation that their .py files were not directories.
171,2/10/2017 14:04,HW1,2,Questions on submiting and deleting files
171,2/10/2017 14:06,HW1,5,Not storing expression in  variable
116,2/10/2017 14:07,HW1,2,Simple syntax error
171,2/10/2017 14:34,HW1,1,Comma was in string when trying to seperate arguments in print()
183,2/10/2017 14:36,HW1,3,using int(input( for a string
313,2/10/2017 15:43,OTHERS,4,"Had problems with files/directories, deleting stuff, etc"
316,2/13/2017 14:21,HW2,2,Needed help checking if invalid in last part of HW
369,2/13/2017 14:57,HW2,3,Was curious about how much commenting was acceptable
310,2/14/2017 13:12,HW2,4,Did HW4 with math and wanted to know if it was ok (sent to Gibson)
184,2/14/2017 13:15,HW2,2,Needed help understanding decision making
335,2/14/2017 14:23,HW2,2,Didn't know you could have many if-else staements
173,2/14/2017 14:46,HW2,3,Figuring out flowchat for program
155,2/14/2017 15:31,HW2,4,Typing space before input
173,2/14/2017 15:40,HW2,2,confused ob methodlogy of asking
155,2/14/2017 15:57,HW2,2,Formatting question
335,2/14/2017 19:03,HW2,2,Confused about if/elif/else blocks
335,2/14/2017 19:17,HW2,3,confused about code design
335,2/14/2017 19:36,HW2,3,
169,2/15/2017 11:09,HW2,3,created help request from home/dorm (not here); help with mod
174,2/15/2017 13:07,OTHERS,1,"Not my student, wanted to get point back on lab."
169,2/15/2017 13:37,HW2,3,Wanted to make sure homework was done correctly.
297,2/15/2017 13:38,HW2,2,Had questions about if statments
151,2/15/2017 15:06,HW2,5,Was missing colons at the end of if statements
151,2/15/2017 15:09,HW2,2,Forgot to enable bash 
155,2/15/2017 15:21,HW2,3,False alarm! But she forgot Sunday and Saturday in part 4
151,2/15/2017 15:27,HW2,2,Over complicating part 2 of the homework 
155,2/15/2017 15:41,HW2,2,Trying to figure out the modulus operator 
151,2/15/2017 15:41,HW2,2,
120,2/15/2017 16:29,HW2,4,showed up 5 minutes later (not here)
257,2/15/2017 16:35,HW2,4,
151,2/16/2017 13:05,HW3,3,Dog question structure
302,2/16/2017 13:20,HW2,3,"confusion between input and print. Understood math, couldnt understood where to go with program though."
151,2/16/2017 13:33,HW3,3,
151,2/16/2017 14:12,HW2,3,Just a sanity check
130,2/16/2017 14:29,HW2,2,"trouble with decision statements and comparing - logic is all right, actually coding it is hard"
173,2/16/2017 14:29,HW2,3,used wrong variable names
138,2/16/2017 16:02,HW2,4,"needed help with how to get min, hour, day from user inupt"
302,2/16/2017 16:03,HW2,3,how to get started on the dog question (hw2_part2)
253,2/16/2017 16:21,HW2,5,"had every possible day checked for (and knew he shouldn't), advised to use mod"
171,2/17/2017 14:05,HW2,5,Needed help with what operator to use for hw2_part4
274,2/17/2017 14:08,HW2,4,not here
171,2/17/2017 14:33,HW2,3,not sure how to use % in part 4
130,2/17/2017 14:36,HW2,3,Help with general syntax of python
171,2/17/2017 15:18,HW2,3,asking the user minimum questions - branching
130,2/17/2017 15:36,HW2,3,didnt know what to do next - branching
130,2/17/2017 16:02,HW2,2,"branching, modulus (%), filesystem "
274,2/17/2017 16:11,HW2,4,He needed help with moving files out of directories he made accidentally 
274,2/17/2017 16:41,HW2,3,was having trouble with if's
316,2/20/2017 10:25,HW3,2,didn't understand problem
121,2/20/2017 13:26,HW3,5,Needed help figuring out logic for HW3 part 4
316,2/20/2017 14:20,HW3,2,needed help keeping track of answer for part2 and getting started part4
369,2/20/2017 15:00,OTHERS,3,put a comment on every single line; told to only comment loops and large blocks
151,2/21/2017 13:55,HW3,2,Needed help with structuring code
151,2/21/2017 14:06,HW3,4,requested again
305,2/21/2017 14:15,HW3,3,confused on multiple conditions for while
151,2/21/2017 14:27,HW3,2,putting psudeocode to code
305,2/21/2017 14:45,HW3,2,Student left (didn't respond?)
151,2/21/2017 14:49,HW3,2,Confused on what was in the while loop
151,2/21/2017 15:13,HW3,2,Couple of logic errors
305,2/21/2017 15:20,HW3,3,syntax error
358,2/21/2017 15:30,HW3,4,"syntax error, > vs >="
305,2/21/2017 15:37,HW3,3,"logic error, < vs >"
335,2/21/2017 19:01,LAB3,4,showed lab3 (didnt finish) and question about hw3
227,2/22/2017 10:02,HW3,5,hw3 clarifications
158,2/22/2017 10:29,LAB4,3,confused on while loop conditions
278,2/22/2017 10:30,HW3,5,issue with conditions on hw3 p2 and p4
102,2/22/2017 10:34,HW4,5,confused about indenting & code belonging to blocks
102,2/22/2017 11:17,HW3,3,Incorrect order of action within a sent. loop
278,2/22/2017 11:28,HW3,5,"manipulating print statments/ end =  """""
118,2/22/2017 11:57,HW3,5,"manipulating print statments/ end =  """""
124,2/22/2017 12:11,HW3,5,cleaning file directory and homework parameter clarification
173,2/22/2017 12:57,HW3,5,Needed help thinking through part 2
173,2/22/2017 13:26,HW3,3,Needed help thinking through part 3 and what to use for the while loop
151,2/22/2017 15:03,OTHERS,3,Needed to be walked through lab 3
184,2/22/2017 15:18,HW3,4,Needed help with the hailstone problem 
155,2/22/2017 15:19,HW3,2,"Created a directory instead of a file, wanted to know about comments, and questionable This works but I don't know why it works"
155,2/22/2017 15:36,HW3,2,Repeat?
155,2/22/2017 15:36,HW3,2,Variable naming conventions question
184,2/22/2017 16:15,HW3,3,"Infinite Loop, not updating condition"
120,2/22/2017 16:24,HW3,5,"Not here, told me they signed in 10 minutes before coming in :( "
217,2/23/2017 12:00,HW3,5,Needed help with when to update a variable when to print the box correctly 
310,2/23/2017 12:08,OTHERS,5,Just wanted to double check that his logic for part3 was a valid use of a while loop
316,2/23/2017 12:28,HW3,2,"Understanding what the ' end="" ' was doing when print each character in the line"
162,2/23/2017 12:31,HW3,4,Needed help with how to structure while loops in part4
112,2/23/2017 12:38,HW3,2,
364,2/23/2017 12:58,OTHERS,3,Didn't understand loops within loops
292,2/23/2017 13:02,HW3,3,Didnt understand counters or nested while loops
302,2/23/2017 13:04,HW3,3,Needed help understanding how while loops check values
151,2/23/2017 13:07,HW3,2,Needed help understanding the if/elif
112,2/23/2017 13:41,HW3,3,student left
184,2/23/2017 13:42,HW3,3,Printing inside while loops (had two seperate loops)
297,2/23/2017 14:19,HW3,3,trying to compare to a value that isn't updated in loop
151,2/23/2017 14:22,HW3,2,print(count+=1)
173,2/23/2017 14:23,HW3,5,"needed help seeing the patterns for part 4 (width * height, rows end in width*count, etc)"
364,2/23/2017 14:56,HW3,3,"needed help seeing the patterns for part 4 (width * height, rows end in width*count, etc)"
173,2/23/2017 15:00,HW3,5,part 4 help - going from printing 1 line to all the lines
169,2/23/2017 15:10,HW3,4,"part 3, variables were all over the place. forgot how to update a variable's value"
364,2/23/2017 15:18,HW3,3,"had part 4 started, hopefully i got her on the right track for when to print the new lines"
179,2/23/2017 15:53,OTHERS,3,not here
138,2/23/2017 15:55,HW3,4,Part 1 logic
356,2/23/2017 15:56,HW3,4,Part 4 printing
253,2/23/2017 16:00,HW3,4,Part 2 logic. How to divide? (Use subtraction)
302,2/23/2017 16:01,HW3,3,How to figure out if a number is even (part 3)
190,2/23/2017 16:05,HW3,3,"Had a solution to part 4 that didn't have a while loop, was confused about intended solution"
169,2/23/2017 16:11,HW3,2,Part 4 using a double while loop - he thought of that strategy but had trouble implementing it (syntax)
138,2/23/2017 16:15,HW3,3,confused on when to reprompt for while loop
356,2/23/2017 16:19,HW3,4,confused on printing in part 4
138,2/23/2017 16:28,HW3,2,nneded help with setting up the while loop
253,2/23/2017 16:41,HW3,5,needed help with printing
302,2/23/2017 16:56,HW3,3,part 4 logic
138,2/23/2017 16:56,HW3,3,off by one error
297,2/23/2017 17:02,HW3,4,wanted confirmation on what to do :)
302,2/23/2017 17:13,HW3,3,"didn't knwo  about end="""
138,2/23/2017 17:14,HW3,2,forgot about %
297,2/23/2017 17:17,HW3,4,infinite loop
292,2/23/2017 17:17,HW3,4,resetting counter
297,2/23/2017 17:25,HW3,4,if-elif probs
138,2/23/2017 17:30,HW3,3,syntax error
190,2/23/2017 17:34,HW3,2,algorithm for part4
302,2/23/2017 17:40,HW3,3,algorithm for part2
138,2/23/2017 17:51,HW3,3,part4
227,2/24/2017 10:01,HW3,5,"Needed clues as to how to get the box"" shape (new lines)"""
306,2/24/2017 10:04,HW3,5,Needed help with doing division without actually using the operator.
101,2/24/2017 10:09,HW3,5,Helped her with part 4: Mentioned how % would be helpful
174,2/24/2017 10:16,HW3,2,Needed help with doing division without actually using the operator.
285,2/24/2017 10:18,HW3,4,Needed help fixing her code structure
101,2/24/2017 10:42,HW3,2,Needed help with positioning print statements
110,2/24/2017 10:59,HW3,3,Needed help with part4: How to get the newlines
306,2/24/2017 11:06,HW3,5,Needed help with hailstones
268,2/24/2017 11:10,HW3,5,Was actually multiplying a list height times.
137,2/24/2017 11:13,HW3,3,printing box in hw-- confused about order of if statement execution
285,2/24/2017 11:27,HW3,4,Hinted that using % would be more helpful since comparing to width would not work.
306,2/24/2017 11:27,HW3,2,if statement ordering
331,2/24/2017 11:40,HW3,4,lab update
269,2/24/2017 11:42,HW3,2,Wanted me to reiterate that you may NOT use the division operator for part 4.
174,2/24/2017 11:44,HW3,2,Else statement accounted for =1 AND odd.
253,2/24/2017 11:47,LAB4,5,Explained to him that another variable to total up the numbers MIGHT be useful.
108,2/24/2017 11:48,HW3,3,Explained to her that division is similar to subtracting multiple times and that you want to count how many times a number goes into another to replicate what the division operator does.
124,2/24/2017 14:04,HW3,5,Having trouble with creating box
151,2/24/2017 14:06,HW3,3,needed help with condition for while loop
174,2/24/2017 14:06,HW3,2,Needed help figuring out how to move to next line for box
108,2/24/2017 14:07,HW3,3,had > instead of >=
120,2/24/2017 14:11,HW3,5,student left
274,2/24/2017 14:12,HW3,3,printing to a new line
135,2/24/2017 14:12,HW3,2,not updating looping variable
258,2/24/2017 14:13,OTHERS,5,needed to store the variable he was subtracting to print at the end
335,2/24/2017 14:19,HW3,2,nevermind
130,2/24/2017 14:20,HW3,3,need help starting part 4
232,2/24/2017 14:23,HW3,5,understanding when variables update
262,2/24/2017 14:29,HW3,4,Needed help with conditions for while loop and if statement
108,2/24/2017 14:30,HW2,3,need help starting part 4
130,2/24/2017 14:35,HW3,2,needed help starting part4
120,2/24/2017 14:36,HW3,5,needed help with looping 
306,2/24/2017 14:41,HW3,5,Needed assistance with getting while loops to run enough times
135,2/24/2017 14:43,HW3,2,nevermind
232,2/24/2017 14:46,HW3,5,"needed help with end =  """""
124,2/24/2017 14:46,HW3,5,"needed help with end =  """""
335,2/24/2017 14:53,HW3,2,"needed help with end =  """""
171,2/24/2017 15:02,HW3,4,stuck on how to implement while loop  for part 4
174,2/24/2017 15:05,HW3,1,Updated height before printing
151,2/24/2017 15:10,HW3,5,Needed help thinking through the part4 counter
329,2/24/2017 15:11,HW3,4,nevermind (came up to me and said he was good)
108,2/24/2017 15:12,HW3,3,needed help with using mod (the new line)
258,2/24/2017 15:18,HW3,4,infinite loop
174,2/24/2017 15:30,HW3,1,student left
130,2/24/2017 15:32,HW3,2,Had to leave so helped early. Was updating height before printing
296,2/24/2017 15:33,OTHERS,2,needed hash files explained
274,2/24/2017 15:33,HW3,5,needed help with while loop logic
346,2/24/2017 15:37,HW3,3,
124,2/24/2017 15:41,HW3,5,needed help with while loop logic
130,2/24/2017 15:54,HW3,2,needed help with part 3
232,2/24/2017 15:54,HW3,5,Wasn't looping enough
258,2/24/2017 16:04,HW3,5,infinite loop when hail at 0
171,2/24/2017 16:07,HW3,4,even vs odd (modulus)
151,2/24/2017 16:15,HW3,5,whiteboarding the while loop
167,2/24/2017 16:22,HW3,4,needed help with using mod for new line
171,2/24/2017 16:24,HW3,3,infinite loop on hailstone (using new variable for calculations)
232,2/24/2017 16:29,HW3,5,while loop went 1 step too far
258,2/24/2017 16:43,HW3,3,using modulus for if statement
118,2/27/2017 14:03,HW4,5,"part4: wasn't appending the last element, part2: need help comparing strings"
118,2/27/2017 14:31,HW4,2,printing after one character that wasn't !
155,2/27/2017 14:43,HW4,5,need help with order inside while loop part 3
369,2/27/2017 14:54,HW4,4,wasnt sure whether or not to use a constant
130,2/28/2017 12:48,LAB5,2,Needed help understanding a counter and how lists work (Needed help with the lab and NOT HW4)
302,2/28/2017 13:22,LAB5,3,Needed help with the lab didn't understand how to change a certain element in a list
316,2/28/2017 13:30,HW4,2,Needed to change the order of his while loop (stored data before asking for data)
130,2/28/2017 14:19,HW4,2,wrong sentienel value
173,2/28/2017 14:54,OTHERS,2,priniing index as index+1
215,2/28/2017 19:26,HW4,5,
215,2/28/2017 19:39,HW4,4,
184,3/1/2017 10:05,HW4,2,didn't get you could use variables as indexers
237,3/1/2017 11:54,HW4,4,upper/lower didnt know if taught/could use
262,3/1/2017 12:04,HW4,4,Appending to a list
101,3/1/2017 12:10,HW4,4,upper/lower didint know how to use
173,3/1/2017 12:14,OTHERS,3,Lab 4 incrementing single items in a list
297,3/1/2017 12:16,HW4,3,Not using a whiel loop to print contents of a lsit
262,3/1/2017 12:37,HW4,2,THE POWER OF SLICING
262,3/1/2017 12:50,HW4,3,infinite loops needed better sentiels
297,3/1/2017 12:57,HW4,3,Needed help using counter to print out two lists at once.
262,3/1/2017 13:02,HW4,4,Was printing out whole list instead of item at each index
237,3/1/2017 13:07,HW4,3,"Created a list of empty "", then was appending"
297,3/1/2017 13:14,HW4,2,Needed explanation of how .lower() and .upper() works
173,3/1/2017 13:15,OTHERS,4,Needed help understanding the lab (had lab earlier before this)
262,3/1/2017 13:25,HW4,2,Needed reminder of .lower() and .upper() functions
143,3/1/2017 15:13,LAB5,5,Needed help with the lab 
242,3/1/2017 15:15,HW4,4,Confusion on how to use .lower()
356,3/1/2017 15:18,HW4,3,"Part 4 of the homework, asked for quanitity even when the user entered stop "
184,3/1/2017 15:22,HW4,3,Grocery list input problem 
242,3/1/2017 15:27,HW4,4,nevermind
356,3/1/2017 15:38,OTHERS,2,Walked through live coding problem 
155,3/1/2017 15:41,HW4,3,Help with \t and the ology part of the homework
242,3/1/2017 15:44,HW4,5,Wasnt accessing the sting with []
173,3/2/2017 11:58,HW4,4,Needed help with getting out of a while loop with QUIT
310,3/2/2017 12:14,OTHERS,5,Questions about formating output
138,3/2/2017 12:20,HW4,3,Needed an intro to lists 
316,3/2/2017 12:25,HW4,3,How to use boolean flags to check whether the string had an exclamation point or not
118,3/2/2017 12:40,HW4,5,
118,3/2/2017 12:58,HW4,5,requested again
118,3/2/2017 12:59,HW4,5,requested again
138,3/2/2017 13:03,HW4,3,
184,3/2/2017 13:03,HW4,3,
334,3/2/2017 13:04,HW4,5,student left
302,3/2/2017 13:06,HW4,3,"Needed help with mv, appened STOP to list which gave indexOutOfBounds"
262,3/2/2017 13:12,HW4,4,Structural stuff with ifs inside while loop
356,3/2/2017 13:24,HW4,3,"used class as variable name which isnt allowed in python, but doesn't show na appropriate error"
138,3/2/2017 13:42,HW4,2,needed help with the input validation while loop
329,3/2/2017 13:43,HW4,4,needed help with finding exclamation point
160,3/2/2017 14:03,HW4,5,didn't understand how upper works
292,3/2/2017 14:16,HW4,2,student left
173,3/2/2017 14:19,HW4,4,didn't understand how lower works
138,3/2/2017 14:30,HW4,3,emacs sux
130,3/2/2017 14:34,HW4,3,lots of questions about how while loops and booleans etc
297,3/2/2017 14:50,HW4,4,Had two while loops instead of one
138,3/2/2017 15:08,HW4,4,was doing pw validation checks inside loop thru the whole string
173,3/2/2017 15:11,HW4,4,"part 2 lowercase + !"" check logic"""
160,3/2/2017 15:15,HW4,3,had <= len()
138,3/2/2017 15:16,HW4,4,infinite while loop hidden in her program
130,3/2/2017 15:28,HW4,3,"had it mostly there, just had output while loop inside of the input while loop (part 3"
137,3/2/2017 15:35,HW4,3,student left ?
173,3/2/2017 15:41,HW4,4,needs to only print when password is definitely invalid (had all checks working though)
262,3/2/2017 15:46,HW4,4,was setting if password is valid to false every time
169,3/2/2017 15:50,HW4,3,"was trying to turn a string into a list, which is superfluous"
160,3/2/2017 15:52,OTHERS,2,"had the right idea for slicing in part 4, just needed help with syntax"
138,3/2/2017 15:54,HW4,3,"no syntax error when i got there, but small while loop logic issue"
302,3/2/2017 15:57,HW4,4,didn't know how to check for if password is all lower or has !
215,3/2/2017 16:05,HW4,5,how to figure out if a string was all lowercase (had a constant with all capital alphabetical characters so I steered her away from that approach)
130,3/2/2017 16:12,HW4,3,Needed help with a ton of errors in a ton of files
184,3/2/2017 16:19,HW4,3,lowercase part of part2
215,3/2/2017 16:19,HW4,5,requested again (part 4 logical setup)
262,3/2/2017 16:19,HW4,4,part 2 lowercase logic stuff
173,3/2/2017 16:19,HW4,3,"needed help with print statement output and using \t"""""
138,3/2/2017 16:26,HW4,3,"also needed help with print statement output and using \t"""""
169,3/2/2017 16:26,HW4,3,"thought that a string entered by the user had to be declared like in examples with strName = blahblah"" in order to be indexed"""
253,3/2/2017 16:34,HW4,5,was stuck on counting loops (looping thru the password to check for a !)
184,3/2/2017 16:51,HW4,3,needed to know if had to loop character by chatacter to check for !
173,3/2/2017 16:55,HW4,2,"had an if statement instead of a while for input, also needed help with logic to check for ology"""""
139,3/2/2017 16:55,HW4,5,wasn't resetting count in while loop
138,3/2/2017 17:00,HW4,3,needed help with what to do for part 4
302,3/2/2017 17:05,HW4,3,needed help with how to check for !
262,3/2/2017 17:08,HW4,4,needed help with checking every letter for ! logic
253,3/2/2017 17:20,HW4,5,needed help with structuring code- didn't have while loop to check for valid password
173,3/2/2017 17:28,HW4,3,help with string slicing
232,3/2/2017 17:30,HW4,5,"ran out of time to help student, gave advice on how to check for !"
358,3/2/2017 17:53,HW4,4,helped with formatting on my way out
137,3/3/2017 10:00,HW4,3,"Wasn't sure if using in"" and ""not in"" was allowed. (?)"""
227,3/3/2017 10:01,HW4,5,Had an unnecessary if statement in her while loop.
215,3/3/2017 10:01,HW4,5,Needed help with string slicing.
130,3/3/2017 10:01,HW4,3,student left
121,3/3/2017 10:04,HW4,4,Had while block in the wrong area.
268,3/3/2017 10:09,HW4,3,Needed help with string slicing.
215,3/3/2017 10:18,HW4,5,finding if char not in string
278,3/3/2017 10:21,HW4,5,finding if char not in string
174,3/3/2017 10:31,HW4,1,Needed help figuring out what to put in the while list to print out the checklist.
120,3/3/2017 10:35,HW4,5,Needed help with string slicing.
215,3/3/2017 10:45,HW4,5,reseting counter each time while loop runs
154,3/3/2017 10:50,HW4,4,finding if char NOT in string
173,3/3/2017 10:59,HW4,3,slicing string that has been indexed from list
138,3/3/2017 10:59,HW4,3,Needed help with string slicing.
143,3/3/2017 11:00,HW4,5,needed help with string slicing.
331,3/3/2017 11:23,HW4,3,"Did not know about len(myList), so I had to teach him lists."
138,3/3/2017 11:25,HW4,3,slicing string that has been indexed from list
108,3/3/2017 11:32,HW4,3,"student left, not sure what happened with the following names"
278,3/3/2017 11:32,HW4,5,office hours over
120,3/3/2017 11:34,HW4,5,office hours over
143,3/3/2017 11:37,HW4,5,part 3 not entering quantity when entering stop
253,3/3/2017 11:39,LAB5,5,office hours over
215,3/3/2017 11:46,HW4,5,office hours over
135,3/3/2017 13:59,HW4,3,How to use .lower to check lowercase
306,3/3/2017 14:00,HW4,5,part 3 not entering quantity when entering stop
174,3/3/2017 14:00,HW4,2,part 1 was incrementing count before printing
262,3/3/2017 14:00,HW4,4,"needed help with slicing ology"""
173,3/3/2017 14:01,HW4,3,need help checking for ! 
151,3/3/2017 14:01,HW4,2,Question about upper and lower and iterating through a string
105,3/3/2017 14:01,HW4,5,checking for !
122,3/3/2017 14:01,HW4,5,"needed help keeping track of !"""""
302,3/3/2017 14:01,HW4,3,Structuring conditionals with while loop 
278,3/3/2017 14:03,HW2,5,loop structure incorrect
184,3/3/2017 14:03,HW4,3,tried to make string into a list
274,3/3/2017 14:05,HW4,5,"wasn't sure how to iterate and check for !"""
232,3/3/2017 14:05,HW4,5,checking for !
243,3/3/2017 14:06,HW4,5,not appending last item to grocery list
108,3/3/2017 14:07,HW2,3,"understaind how to find the !"""""
350,3/3/2017 14:07,HW4,5,understanding indexing
157,3/3/2017 14:08,HW2,2,"trouble with !"" checking"""
306,3/3/2017 14:10,HW4,5,needed help with multiple parts
176,3/3/2017 14:10,HW4,5,wrong slice at end of string
258,3/3/2017 14:10,HW4,5,"trouble with !"" checking"""
242,3/3/2017 14:15,HW4,5,"trouble with slicing, actual problem is layout of loops"
120,3/3/2017 14:15,HW4,5,"trouble with checking for !"""""
297,3/3/2017 14:17,HW4,3,had trouble understanding indexing
329,3/3/2017 14:25,HW4,4,slicing string for last character
174,3/3/2017 14:26,HW4,1,trouble checking for if it's lowercase
143,3/3/2017 14:29,HW4,5,"trouble with checking for !"""""
135,3/3/2017 14:32,HW4,3,had problems with logical positioning 
262,3/3/2017 14:32,HW4,4,"needs to separate list creation from checking for ology"""""
105,3/3/2017 14:36,HW2,5,needed help understanding slicing with len
173,3/3/2017 14:40,HW4,4,"trouble with checking for !"""""
278,3/3/2017 14:44,HW2,5,Had issues with indexing syntax
108,3/3/2017 14:45,HW4,3,"had problem asking for qunatity after entering """
151,3/3/2017 14:45,HW4,2,wasn't setting boolean flags to false
306,3/3/2017 14:47,HW4,5,student left
232,3/3/2017 14:54,HW2,5,help with controlling while loops for password
244,3/3/2017 14:59,HW4,5,What the question asked. Very succicent 
121,3/3/2017 15:02,HW4,5,was missing setting a boolean
184,3/3/2017 15:04,HW4,3,"needed help slicing for ology"""""
189,3/3/2017 15:04,HW4,5,"was slicing the list, not the string"
243,3/3/2017 15:14,HW4,4,exclamation case
302,3/3/2017 15:14,HW4,4,"trouble with checking for !"""""
122,3/3/2017 15:18,HW4,5,Forgot to update counters 
258,3/3/2017 15:18,HW4,4,Missing parens
130,3/3/2017 15:20,HW4,3,checking for !
120,3/3/2017 15:21,HW4,5,extra input() at end of while loop
171,3/3/2017 15:22,HW4,4,wrong code order
274,3/3/2017 15:29,HW4,5,small problems with boolean flag
157,3/3/2017 15:32,HW4,1,"needed help determining location of """
242,3/3/2017 15:35,HW4,5,student left
108,3/3/2017 15:38,HW4,3,looping through a list and printing
135,3/3/2017 15:44,HW4,3,help with appending 10 classes
151,3/3/2017 15:55,HW4,2,was using password for both boolean and string
262,3/3/2017 16:09,HW4,4,not accessing element of list inside while loop
187,3/3/2017 16:13,HW4,3,asking for password again inside if statements
108,3/3/2017 16:14,HW4,3,appending 10 items to list
244,3/3/2017 16:30,HW4,5,infinite loop due to not updating loop variable
174,3/3/2017 16:34,HW4,2,"wasn't using a while loop to check for !"""""
258,3/3/2017 16:34,HW4,4,Variable slicing
243,3/3/2017 16:38,HW4,3,checking for !
105,3/3/2017 16:39,HW4,5,was using class as a variable
130,3/3/2017 16:42,HW4,3,checking if lowercase
171,3/3/2017 16:43,HW4,4,office hours over
189,3/3/2017 16:46,HW4,5,office hours over
151,3/3/2017 16:47,HW4,2,office hours over
331,3/3/2017 16:52,HW4,4,office hours over
302,3/3/2017 17:00,HW4,5,office hours over
187,3/3/2017 17:00,HW4,2,office hours over
305,3/6/2017 14:41,LAB5,5,need help tallying and printing votes for lab 5
305,3/6/2017 15:29,PROJ1,2,Questions about the design doc
310,3/7/2017 12:25,OTHERS,5,Questions about tabing 
174,3/7/2017 13:18,OTHERS,2,Needed help understanding return statements
310,3/7/2017 13:26,OTHERS,1,I told him why sometimes it might over tab. I told him that as long as his outputs are easy to read he should be fine when it comes to grading.
149,3/8/2017 10:19,PROJ1,2,just needed sanity check
130,3/8/2017 11:07,LAB6,3,"I helped earlier, jsut forgot to input name as I wlaked over. She needed help with how function return and call each other. "
105,3/8/2017 11:21,OTHERS,2,Functions and how their returns work
155,3/8/2017 11:42,PROJ1,3,How to comment
136,3/8/2017 12:32,PROJ1,4,"No show, also checked when it first popped jsut forgot to add name"
297,3/8/2017 13:38,PROJ1,3,Didn't realize they could use the same function to get min and max value from user
151,3/8/2017 15:06,PROJ1,3,"Not sure on function returns and formal paramaters, core ideas of functions"
128,3/8/2017 15:18,PROJ1,4,Questions about design doc
